,acousticness,artists,danceability,duration_ms,energy,explicit,id,instrumentalness,key,liveness,loudness,mode,name,popularity,release_date,speechiness,tempo,valence,year,genres
1588,0.907,"Leopold Stokowski, Philadelphia Orchestra",0.212,565427,0.13699999999999998,0,2CIY2peTbSKNNHgykODpO4,0.308,2,0.0611,-17.074,0,"Toccata And Fugue In D Minor, BWV 565",34,1990-01-01,0.0397,83.78399999999998,0.141,1990,classical
1589,0.7859999999999999,"Antônio Carlos Jobim, Frank Sinatra",0.309,131587,0.17800000000000002,0,1Dv7lvKVxBJg9fCWTA7Dt0,0.000731,0,0.106,-16.756,1,If You Never Come To Me (Inútil Paisagen),34,1967-03,0.032,96.085,0.114,1967,"classical, jazz"
1590,0.973,"Agustín Barrios Mangoré, John Williams",0.344,432400,0.0556,0,2qEGnHhpYEjXbjiceeKk0F,0.862,11,0.0806,-28.592,0,La catedral,34,1979,0.047,116.078,0.184,1979,"classical, country"
1591,0.994,"Brian Eno, Harold Budd",0.197,254000,0.0068200000000000005,0,6AlMwXm6QSGErCZU2rhtoi,0.908,4,0.106,-31.21,0,Failing Light - 2004 Digital Remaster,34,1980,0.0414,63.56800000000001,0.152,1980,"classical, pop, rock"
1592,0.813,"John Williams, London Symphony Orchestra",0.31,411827,0.34600000000000003,0,3JHiyPyEGfdFlAgbX0iS7M,0.91,0,0.107,-11.232,1,Washington Ending / Raiders March,34,1981-01-01,0.0392,131.11700000000002,0.152,1981,"classical, country"
1593,0.975,"Giacomo Puccini, Mirella Freni, Wiener Philharmoniker, Herbert von Karajan",0.159,275507,0.0655,0,4z6MjoY4K07vqeI4023U2Q,0.000134,1,0.0925,-19.073,1,"Madama Butterfly / Act 2: ""Un bel dì vedremo""",34,1974-01-01,0.0515,76.42,0.0597,1974,classical
1594,0.94,"Ottorino Respighi, Boston Symphony Orchestra, Seiji Ozawa",0.203,183267,0.16399999999999998,0,1htHR9FmSnAu3N2JM1zm9J,0.8909999999999999,0,0.0792,-19.205,0,"Ancient Airs And Dances, Suite No.3, P. 172: 3. Siciliana",34,1979-01-01,0.045,108.708,0.226,1979,classical
1595,0.947,"Pyotr Ilyich Tchaikovsky, André Previn, London Symphony Orchestra",0.0849,180640,0.209,0,3NlS13lSrtQAL9Nf7ZNoRW,0.853,4,0.149,-19.25,0,"Tchaikovsky: Swan Lake, Op. 20, Act 2: No. 14, Scene (Moderato)",34,1976,0.0441,78.378,0.0411,1976,classical
1596,0.888,"Johann Sebastian Bach, Elizabeth Wallfisch/Lisa Beznosiuk/Malcolm Proud/Orchestra of the Age of Enlightenment, Elizabeth Wallfisch, Orchestra of the Age of Enlightenment",0.376,561973,0.263,0,3aLwh0vXe5gkP5WqUH8w4K,2.5e-05,1,0.239,-18.372,1,"Bach, J.S.: Brandenburg Concerto No. 5 in D Major, BWV 1050: I. Allegro",34,1989,0.0333,100.771,0.691,1989,classical
1597,0.917,"Pyotr Ilyich Tchaikovsky, André Previn, London Symphony Orchestra",0.21600000000000005,704640,0.134,0,4c36o7MDZ6iXYedl5DMvO5,0.685,2,0.192,-20.053,1,"Swan Lake, Op.20, Act I: 5. Pas de deux",34,1976,0.055,80.861,0.124,1976,classical
1598,0.962,"Pyotr Ilyich Tchaikovsky, André Previn, London Symphony Orchestra",0.244,223707,0.124,0,2pck96k8ppFMeyTONVAFLq,0.899,2,0.193,-19.81,1,"Swan Lake, Op.20, Act I: 3. Scene (Allegro moderato)",34,1976,0.0481,101.836,0.222,1976,classical
1599,0.963,"Pyotr Ilyich Tchaikovsky, André Previn, London Symphony Orchestra",0.285,598867,0.0718,0,3lE4dnrzG0FQxg67ZOl9rx,0.8909999999999999,10,0.0595,-19.658,1,"Swan Lake, Op.20, Act I: 4. Pas de trois",34,1976,0.0415,116.612,0.116,1976,classical
1600,0.942,"Pyotr Ilyich Tchaikovsky, André Previn, London Symphony Orchestra",0.265,1070773,0.0666,0,2LETLpcnlbL2d5IbnNYLf8,0.748,1,0.0769,-22.209,0,"Swan Lake, Op.20, Act II: 13. Dances of the Swans",34,1976,0.0423,144.025,0.0725,1976,classical
1601,0.888,"Wolfgang Amadeus Mozart, Cristina Deutekom, Wiener Philharmoniker, Sir Georg Solti",0.402,173960,0.228,0,4bkdxDtqsuSHOTHos4hxCv,0.000627,5,0.329,-17.104,1,"Die Zauberflöte, K.620 / Act 2: ""Der Hölle Rache kocht in meinem Herzen""",34,1970-01-01,0.0552,142.662,0.173,1970,classical
1602,0.994,"Johann Sebastian Bach, Glenn Gould",0.4,356507,0.0537,0,2RPeCwKap7tb9JlzLtRiJv,0.922,2,0.117,-33.05,0,"Italian Concerto in F Major, BWV 971: II. Andante",34,1957,0.0417,106.219,0.175,1957,classical
1603,0.534,"John Williams, London Symphony Orchestra",0.292,321453,0.31,0,0Q9LIPNdjWUfK5uLwWmTSg,0.924,7,0.112,-15.322,1,Rebels at Bay,34,1980-01-01,0.0362,75.05,0.14,1980,"classical, country"
1604,0.76,"John Williams, London Symphony Orchestra",0.145,143080,0.181,0,5wL5AFeuzeoTtkUiJ5SVdD,0.6559999999999999,0,0.102,-17.833,0,Rebel Briefing,34,1983-01-01,0.0442,103.082,0.0329,1983,"classical, country"
1605,0.628,"John Williams, London Symphony Orchestra",0.11,310307,0.233,0,2NyL3BnrZJXhQT32WFZJDc,0.81,10,0.146,-14.921,1,Main Title (The Story Continues),34,1983-01-01,0.0381,75.839,0.0797,1983,"classical, country"
1606,0.964,"Ralph Vaughan Williams, Academy of St. Martin in the Fields, Sir Neville Marriner",0.127,255107,0.07,0,7ewaVft9jaB3eXlcvWPiVI,0.8809999999999999,0,0.403,-26.885,0,Fantasia on Greensleeves,34,1972-10-01,0.042,88.584,0.117,1972,classical
1607,0.994,"Harold Budd, Brian Eno",0.0693,194453,0.00313,0,4dUIwKF5cQ4efJELwG8cpm,0.8759999999999999,7,0.109,-41.164,0,The Pearl - 2005 Digital Remaster,34,1984,0.0471,73.878,0.0385,1984,"classical, pop, rock"
1608,0.0104,Michael Schenker Group,0.339,285493,0.792,0,4LNuMOrqoTRyViAd2lPYHB,0.00388,5,0.48,-10.038,1,On and On - 2009 Remaster,34,1981-01-01,0.0804,138.553,0.262,1981,"classical, metal, rock"
1609,0.639,Solo,0.759,229027,0.551,0,5Xv3eesPSCo1YVdU2RePWe,3.9e-06,9,0.109,-6.767,0,Heaven,34,1995-01-01,0.031,87.964,0.743,1995,classical
1610,0.976,"Pyotr Ilyich Tchaikovsky, Vladimir Ashkenazy, London Symphony Orchestra, Lorin Maazel",0.39,221257,0.258,0,2Xz4hxOYFPVdbZQuEq49FY,0.8809999999999999,1,0.165,-14.175,1,"Piano Concerto No. 1 in B-Flat Minor, Op. 23, TH 55: 1. Allegro non troppo e molto maestoso - Excerpt",34,1963,0.0297,78.01100000000002,0.15,1963,classical
1611,0.986,"Antonio Vivaldi, Isaac Stern, Jerusalem Music Center Chamber Orchestra",0.0919,200733,0.0674,0,2LuXJWJOadRnmdK0Be1Q9n,0.236,1,0.0852,-25.817,0,"Concerto for Violin, Strings and Continuo in E Major, RV 269 ""La primavera"": II. Largo",34,1956,0.0473,76.883,0.0527,1956,classical
1612,0.953,"Leonard Bernstein, Larry Kert, West Side Story Original Broadway Cast",0.188,157027,0.102,0,4UvnV6JS4anYldIsuCDeiB,0.0,10,0.18600000000000005,-18.123,1,West Side Story (Original Broadway Cast): Act I: Maria,34,1957,0.0329,88.398,0.153,1957,classical
1613,0.984,"Richard Wagner, Berliner Philharmoniker, Herbert von Karajan",0.157,857333,0.0497,0,4WjEY877D3AgyMLqMKrUsV,0.917,8,0.0465,-22.233,1,Parsifal: Prelude,34,1981-01-01,0.0414,71.438,0.0278,1981,classical
1614,0.8370000000000001,"Johann Pachelbel, Jean-François Paillard, Orchestre de chambre Jean-François Paillard",0.203,432173,0.17600000000000002,0,1fXuAfqd8FrUjkiL5E4kuo,0.795,2,0.138,-17.796,1,"Pachelbel: Canon in D Major, P. 37",34,1965,0.0368,130.442,0.24,1965,classical
1615,0.953,"Ludwig van Beethoven, Takako Nishizaki, Jenő Jandó",0.516,386707,0.11,0,2QYyAimPPFvDGxGA5LBgki,0.156,9,0.0478,-22.754,1,"Violin Sonata No. 9 in A Major, Op. 47 ""Kreutzer"": III. Finale: Presto",34,1990-03-15,0.0388,93.025,0.345,1990,classical
1616,0.705,"Johann Sebastian Bach, Simon Preston",0.303,150800,0.158,0,4HE2Ex0bjbj3YNXmV01OoM,0.259,2,0.239,-15.529000000000002,0,"Toccata and Fugue in D Minor, BWV 565: 1. Toccata",34,1989-01-01,0.0417,83.546,0.108,1989,classical
1617,2.8000000000000013e-05,Dead Can Dance,0.251,307307,0.341,0,29bfKPrd3bwOdyHrzvl1Fm,0.15,1,0.0915,-10.104,1,Anywhere Out Of The World (Remastered),34,1987,0.0368,122.507,0.0531,1987,"classical, pop"
1618,0.995,"William Byrd, Glenn Gould",0.317,341920,0.139,0,2VkC2kyZQbKUrDgmKayLsI,0.908,0,0.102,-21.881,1,Sellinger's Round,34,1970,0.0351,97.494,0.685,1970,classical
1619,0.984,"Wolfgang Amadeus Mozart, Anton Gisler, Werner Tripp, Wiener Philharmoniker, Karl Böhm",0.218,583000,0.11,0,4ynnYRQYfCgfosicB8WmKG,0.887,2,0.0995,-23.744,1,"Flute Concerto No.1 In G, K.313: 2. Adagio non troppo",34,1998-01-01,0.0419,90.722,0.0747,1998,classical
1620,0.000449,Michael Schenker Group,0.305,257560,0.92,0,5CbaJUpxCKc8a3Zx33NrOI,0.86,2,0.39,-7.774,1,Into the Arena - 2009 Remaster,34,1980-01-01,0.118,109.097,0.35600000000000004,1980,"classical, metal, rock"
1621,0.935,"Antonín Dvořák, Wiener Philharmoniker, Herbert von Karajan",0.0882,747000,0.00575,0,1e6trFi8oxi8goRZpViKZr,0.856,1,0.0715,-33.459,1,"Symphony No.9 In E Minor, Op.95, B. 178 ""From The New World"": 2. Largo",34,1985-10-01,0.0419,85.743,0.036000000000000004,1985,classical
1622,0.994,"Ludwig van Beethoven, Jenő Jandó",0.34600000000000003,347973,0.0113,0,6R9KwAd7wPHfY0OEUzVCkD,0.893,1,0.103,-31.852,1,"Piano Sonata No. 23 in F Minor, Op. 57 ""Appassionata"": II. Andante con moto",34,1988-03-07,0.0539,118.355,0.105,1988,classical
1623,0.981,"Giuseppe Verdi, Plácido Domingo, Wiener Philharmoniker, Carlo Maria Giulini",0.301,186000,0.0576,0,169wDNQzeVeHP8xOV3c1wa,0.00378,11,0.115,-21.991,1,Rigoletto / Act 3: La donna è mobile,34,1980-01-01,0.0506,168.134,0.269,1980,"classical, pop"
1624,0.991,"Johannes Brahms, Glenn Gould",0.333,580573,0.032,0,6U2bkhwmb8u1fDEgxGPETv,0.917,11,0.073,-27.663,1,"4 Ballades, Op. 10: No. 4 in B Major. Andante con molto",34,1961,0.0441,137.201,0.0569,1961,classical
1625,0.97,"Carl Maria von Weber, Berliner Philharmoniker, Herbert von Karajan",0.308,527933,0.127,0,1pHdcrWyIi2YI7Ara8u5es,0.8009999999999999,2,0.127,-18.038,1,"Invitation to the Dance, Op.65 (Aufforderung zum Tanze) - Orchestrated By H. Berlioz: Moderato - Allegro vivace - Vivace - Moderato",34,1986-01-01,0.0396,121.859,0.123,1986,classical
1626,0.993,"Johannes Brahms, Glenn Gould",0.448,334760,0.0146,0,2wP269aoVYeJU7Klzm2BC7,0.885,3,0.0862,-28.024,1,"Intermezzo No. 1 in E-Flat Major, Op. 117 - Andante moderato - Remastered",34,1961,0.0691,76.4,0.142,1961,classical
1627,0.978,Joe Hisaishi,0.392,125293,0.0214,0,4gyLeH5ZbetgEiIOEEb8z3,0.353,0,0.112,-21.244,0,Sheeta's Decision,34,1986,0.0606,174.105,0.171,1986,"classical, country"
1628,0.972,"Johann Stamitz, Tafelmusik Baroque Orchestra, Jeanne Lamon",0.313,295667,0.0123,0,1I0lC0bCeEiykjEjx4mFWA,0.094,9,0.159,-28.118,1,"Concerto in G Major for Flute, Strings, and Basso Continuo: II. Adagio",34,1993,0.035,70.7,0.16899999999999998,1993,classical
1629,0.971,"Umberto Giordano, Montserrat Caballé, Luciano Pavarotti, National Philharmonic Orchestra, Riccardo Chailly",0.262,219427,0.255,0,1GpbnVAJrQEngYgvkUzs7b,2.7e-05,5,0.5479999999999999,-13.748,1,Andrea Chénier / Act 4: Vicino a te,34,1984-01-01,0.0453,89.211,0.0531,1984,"classical, pop"
1630,0.7390000000000001,Leroy Anderson,0.328,169427,0.14400000000000002,0,6ecG5Am0TRxn0uwZBQHA3L,0.919,2,0.129,-21.882,1,Blue Tango,34,1988-09-15,0.0331,124.489,0.649,1988,"classical, pop"
1631,0.0293,Dead Can Dance,0.232,203027,0.189,0,7lEYBgha1ZATiDRin1LEk2,0.0,4,0.101,-15.611,0,Severance (Remastered),34,1988,0.0322,73.24,0.0691,1988,"classical, pop"
1632,0.0122,Dead Can Dance,0.385,375280,0.362,0,2tuyexwlVmFNecyT1Rblzl,0.000261,1,0.12,-9.2,1,Xavier (Remastered),34,1987,0.0298,75.166,0.196,1987,"classical, pop"
1633,0.956,"Giacomo Puccini, Vienna State Opera Chorus, Wiener Philharmoniker, Herbert von Karajan",0.158,183573,0.00313,0,36I8o5FnN9f12DePkYYMQy,0.923,10,0.0784,-44.15,1,Madama Butterfly / Act 2: Coro a bocca chiusa (Humming Chorus),34,1974-01-01,0.0394,77.968,0.0389,1974,classical
1634,0.8079999999999999,Joe Hisaishi,0.375,64520,0.281,0,04T8DbhEzlo0gXZXLk46i1,0.328,7,0.353,-13.825,1,The Baker's Assistant,34,1989-08-10,0.0337,124.618,0.638,1989,"classical, country"
1635,0.675,"Sergei Prokofiev, Slovak Radio Symphony Orchestra, Ondrej Lenard",0.493,42893,0.0249,0,4G2uNWAbB6MdCP67qQRkbJ,0.993,3,0.57,-32.122,1,"Peter and the Wolf, Op. 67: Peter in the meadow",34,1990-07-02,0.0446,114.786,0.111,1990,classical
1636,0.8640000000000001,"New York Philharmonic, Leonard Bernstein",0.321,540467,0.219,0,4LbYUm6vHnmV1exEzYZg1z,0.885,9,0.128,-19.901,0,"Introduction and Rondo capriccioso, Op. 28",34,1959,0.0411,90.851,0.34,1959,classical
1637,0.957,"Johann Sebastian Bach, Mark Bennett, Rachel Beckett, Paul Goodwin, Monica Huggett, Orchestra of the Age of Enlightenment",0.653,307200,0.29100000000000004,0,3AKAAbFYypDMas1MV8Nhot,0.782,4,0.341,-15.715,1,"Bach: Brandenburg Concerto No. 2 in F Major, BWV 1047: I. (without tempo indication)",34,1989,0.0651,96.709,0.828,1989,classical
1638,0.884,"Cesare Andrea Bixio, Giuseppe Di Stefano, Dino Olivieri",0.15,193547,0.2,0,2wjwzY4BFijBxmnV5b2y2x,0.000229,0,0.322,-15.843,1,"Parlami d'amore, Mariù",34,1959-01-01,0.0354,82.676,0.147,1959,classical
1639,0.569,"Tomaso Antonio Vitali, Jascha Heifetz, Richard Ellsasser",0.17,571773,0.4370000000000001,0,2L2qyEu9XnNd6WqsDdORwb,0.8809999999999999,7,0.513,-9.835,0,Chaconne in G Minor,34,1959,0.0372,80.34899999999998,0.0679,1959,classical
1640,0.8590000000000001,"John Williams, London Symphony Orchestra",0.197,276480,0.108,0,2Nh7tGG4fQcEvKd824PNg7,0.7490000000000001,2,0.131,-20.444000000000006,1,The Walls Converge,33,1977-01-01,0.036000000000000004,96.387,0.0751,1977,"classical, country"
1641,0.99,"Johannes Brahms, Tal & Groethuysen",0.38,138933,0.0774,0,7blnVawphRTTLNZjr0hQtv,0.919,6,0.102,-21.466,1,Hungarian Dance No. 5 in F-sharp minor,33,1965,0.0484,80.8,0.418,1965,classical
1642,0.772,"Antônio Carlos Jobim, Frank Sinatra",0.433,189147,0.36,0,46vkomL5vTShPCg1Jib22j,4.67e-06,11,0.117,-10.624,1,Off Key (Desafinado),33,1967-03,0.0346,120.995,0.376,1967,"classical, jazz"
1643,0.00294,Savatage,0.312,355893,0.675,0,5gyPxNwQlovXzgcjNjZGYY,0.000147,7,0.249,-10.077,1,Edge of Thorns,33,1993-03-16,0.0436,93.153,0.258,1993,"classical, metal, rock"
1644,0.969,"Isaac Albéniz, John Williams",0.4320000000000001,251307,0.123,0,2l6vtRbDUMgRdtGAEprXZa,0.898,2,0.118,-19.62,1,"12 Piezas caracteristicas, Op. 92: No. 12, Torre Bermeja (Arranged by John Williams for Guitar)",33,1981,0.0372,104.936,0.385,1981,"classical, country"
1645,0.913,"Pyotr Ilyich Tchaikovsky, Orchestra of the Royal Opera House, Covent Garden, Mark Ermler",0.395,134173,0.0225,0,4G4ad8GZGqIi5vMAiGPeYj,0.953,4,0.156,-32.611999999999995,0,"The Nutcracker, Op. 71: No. 14, Variation II - Dance of the Sugar-Plum Fairy",33,1989-03-07,0.0353,117.202,0.217,1989,classical
1646,0.8740000000000001,"John Williams, Isaac Stern, Fiddler On The Roof” Motion Picture Orchestra",0.575,109227,0.179,0,2ZYAYjnHuot251OB2zhcnW,0.804,7,0.353,-13.924,1,Finale,33,1971-08-24,0.0419,81.941,0.35200000000000004,1971,"classical, country"
1647,0.605,"John Williams, London Symphony Orchestra",0.17,213920,0.114,0,3kqg0gYmuQZvqVZQvRG3Ni,0.852,3,0.263,-22.389,1,The Magic Tree,33,1980-01-01,0.047,113.874,0.037000000000000005,1980,"classical, country"
1648,0.984,"Camille Saint-Saëns, Pascal Rogé, Cristina Ortiz, London Sinfonietta, Charles Dutoit",0.192,151173,0.0371,0,0W4kuUA1ZoBrJ6ELXRgLE9,0.937,9,0.129,-35.398,0,"Le Carnaval des Animaux, R. 125: 7. Aquarium",33,1980-01-01,0.0409,136.14700000000002,0.147,1980,classical
1649,0.877,"Brian Eno, Harold Budd",0.139,238240,0.17600000000000002,0,31aECKjYHYUwWApiOaLLU2,0.949,8,0.373,-22.751,0,Wind In Lonely Fences - 2004 Digital Remaster,33,1980,0.0374,93.284,0.0363,1980,"classical, pop, rock"
1650,0.96,"Cocteau Twins, Harold Budd",0.205,455800,0.0257,0,5K5NG7aJtMgnu0a4FNP3Yv,0.945,11,0.0936,-26.922,1,The Ghost Has No Home,33,1986-11-10,0.0395,112.679,0.0581,1986,"classical, pop, rock"
1651,0.991,"Johann Sebastian Bach, András Schiff",0.278,195533,0.0784,0,4jOrVPvsjQz78jeMxeOTDK,0.873,9,0.0707,-30.525,0,"English Suite No.2 in A minor, BWV 807: 2. Allemande",33,1988-01-01,0.0464,128.019,0.562,1988,classical
1652,0.858,"Johannes Brahms, Wiener Philharmoniker, Claudio Abbado",0.233,249336,0.212,0,0JAz38cFdhvoLznPLrNN7X,0.825,6,0.14300000000000002,-17.33,0,Hungarian Dance No.4 In F Sharp Minor,33,1984-01-01,0.0317,80.441,0.297,1984,classical
1653,0.00114,Joe Satriani,0.308,194240,0.974,0,7xXGnYqfPeGCu4SSggDjtR,0.8390000000000001,11,0.108,-3.643,0,Back to Shalla-Bal,33,1989-10-30,0.124,165.016,0.393,1989,"classical, metal, rock"
1654,0.97,"Claude Debussy, Dong-Suk Kang, Pascal Devoyon",0.274,292467,0.0668,0,1HiZmYO2nTKI71vLKy9usk,0.226,2,0.047,-22.13300000000001,0,Violin Sonata in G Minor: I. Allegro vivo,33,1990-03-15,0.0452,101.385,0.0598,1990,classical
1655,0.159,Dead Can Dance,0.29,309613,0.341,0,2vyya9wvUxsgHQTJr6E7zC,0.00243,6,0.0677,-12.714,1,Ullyses (Remastered),33,1988,0.0297,182.025,0.052000000000000005,1988,"classical, pop"
1656,0.984,Antônio Carlos Jobim,0.279,201133,0.0892,0,7tjSDfvtkK5GGXy1O1as2e,0.948,8,0.108,-17.352,1,Chanson Pour Michelle - Instrumental,33,1985-01-01,0.0321,74.301,0.0384,1985,"classical, jazz"
1657,0.988,"Felix Mendelssohn, Benjamin Frith, Slovak State Philharmonic Orchestra, Kosice, Robert Stankovsky",0.26,464667,0.016,0,72dgfW1USZQy5liiRxkeS7,0.883,10,0.0717,-30.089,1,"Piano Concerto No. 2 in D Minor, Op. 40, MWV O11: II. Adagio - Molto sostenuto",33,1993-11-16,0.0385,130.71200000000002,0.0379,1993,classical
1658,0.994,"Robert Schumann, Murray Perahia",0.365,201413,0.0020800000000000003,0,57Mo8Bh4uFGjzD3oVOOFxI,0.915,10,0.086,-38.781,1,"Kreisleriana, Op. 16: IV. Sehr langsam",33,1973,0.0506,64.493,0.0782,1973,classical
1659,0.982,"Frédéric Chopin, Vladimir Horowitz",0.208,156907,0.201,0,2Wggm6ZACJJAwbMGG388H6,0.908,5,0.269,-18.979,0,"Étude in C Minor, Op. 10, No. 12 ""Revolutionary""",33,1963,0.0286,87.70200000000001,0.188,1963,classical
1660,0.97,"Giacomo Puccini, Plácido Domingo, Wiener Philharmoniker, Herbert von Karajan, Vienna State Opera Chorus",0.122,195200,0.185,0,53rXxBAcaonEn3vRDKu6eI,0.0508,2,0.381,-16.07,1,"Turandot / Act 3: ""Nessun dorma""",33,1982-01-01,0.0424,84.904,0.0454,1982,"classical, pop"
1661,0.99,"Wolfgang Amadeus Mozart, János Rolla, Dale Clevenger, Franz Liszt Chamber Orchestra, La Grande Écurie et la Chambre du Roy, Jean-Claude Malgoire",0.21600000000000005,283133,0.00843,0,3lYtKnLTruwOGr1noGi2D9,0.845,8,0.111,-27.064,1,"Concerto for Horn and Orchestra in E-flat Major, K.447: II. Romance. Larghetto - Instrumental",33,1979,0.0401,70.452,0.14400000000000002,1979,classical
1662,0.988,"Frédéric Chopin, Murray Perahia",0.231,307000,0.0337,0,2WND4rEfpeAWE0T9Cqqrgw,0.938,1,0.108,-28.199,1,"Fantaisie-impromptu in C-Sharp Minor, Op. 66",33,1985-08-03,0.0407,78.14699999999998,0.07400000000000001,1985,classical
1663,0.929,Joe Hisaishi,0.311,153373,0.0897,0,2ls1m8eUP39MifloK3nBFu,0.917,0,0.147,-16.256,0,A Sea of Clouds in the Moonlight,33,1986,0.0321,86.73299999999998,0.0747,1986,"classical, country"
1664,0.00172,Clan of Xymox,0.5710000000000001,461307,0.601,0,7bIb86uCKTkFXaYriGJJa0,0.7659999999999999,5,0.247,-11.773,0,Stranger,33,1985-07-01,0.0345,129.075,0.142,1985,"classical, pop, rock"
1665,0.968,"Johann Sebastian Bach, Yo-Yo Ma",0.224,243520,0.0452,0,5BSTDnS8drJLOwpL4Co4K2,0.934,2,0.133,-23.312,0,"Cello Suite No. 2 in D Minor, BWV 1008: I. Prélude",33,1983,0.05,123.673,0.226,1983,"classical, hiphop, pop"
1666,0.958,"Johann Sebastian Bach, Yo-Yo Ma",0.33,153147,0.154,0,2Y9HshitG2sK0LZjNHsVJC,0.846,3,0.117,-24.64,1,"Cello Suite No. 4 in E-Flat Major, BWV 1010: VI. Gigue",33,1983,0.0498,104.184,0.8690000000000001,1983,"classical, hiphop, pop"
1667,0.973,"Johann Sebastian Bach, Yo-Yo Ma",0.423,234240,0.0948,0,0w9xYEvm1nd4S9v04zftup,0.858,2,0.187,-22.659,1,"Cello Suite No. 6 in D Major, BWV 1012: VI. Gigue",33,1983,0.0464,70.596,0.687,1983,"classical, hiphop, pop"
1668,0.8640000000000001,Joe Hisaishi,0.203,142093,0.0892,0,1PG3ytAkyimQ3w3jKJpeEj,0.794,2,0.0782,-18.479,1,Un Unusual Painting,33,1989-08-10,0.0356,140.775,0.126,1989,"classical, country"
1669,0.987,Philip Glass,0.29,339733,0.0126,0,4MQjH7bUOKCZlJXtAlfzDK,0.943,4,0.0973,-27.648000000000003,0,Metamorphosis: One,33,1989-08-22,0.0592,117.779,0.0333,1989,"classical, country"
1670,0.261,Solo,0.782,243667,0.759,0,2PezcbOknrIxEylhhzedVT,0.0,8,0.102,-5.87,1,Where Do U Want Me To Put It,33,1995-01-01,0.0447,87.01,0.779,1995,classical
1671,0.122,Clan of Xymox,0.481,317773,0.517,0,0r4QoxBnYj3ZEJFQBNOsPY,0.0257,5,0.271,-12.593,0,Louise,33,1986-11-01,0.0329,126.425,0.414,1986,"classical, pop, rock"
1672,0.977,"Gaetano Donizetti, Luciano Pavarotti, Orchestra del Teatro Comunale di Bologna, Richard Bonynge",0.205,207733,0.193,0,1YBAEaeCVt5DvgEF47vRX0,1.42e-05,0,0.0869,-16.777,1,"La Favorita / Act 4: Spirto gentil, de' sogni miei",33,1978-01-01,0.0514,65.946,0.0665,1978,"classical, pop"
1673,0.906,"Edvard Grieg, Gothenburg Symphony Orchestra, Neeme Järvi",0.103,312880,0.00535,0,06WLIvuWonQZLjfEW4gjgV,0.0132,9,0.0653,-39.751,0,"Peer Gynt Suite No. 2, Op. 55: 4. Solveig's Song",33,1987-01-01,0.0529,74.524,0.0352,1987,classical
1674,0.0819,Joe Satriani,0.711,340507,0.598,0,3NEjVofmH5hcab8Kn0wp3M,0.727,4,0.0851,-7.314,0,Echo,33,1987,0.0417,136.872,0.664,1987,"classical, metal, rock"
1675,0.00855,Michael Schenker Group,0.396,351893,0.802,0,5taiGmpuzPda1Ys9VC6dnw,0.231,9,0.103,-8.005,1,Desert Song - 2009 Remaster,33,1982-01-01,0.0391,123.479,0.459,1982,"classical, metal, rock"
1676,0.994,"Erik Satie, Pascal Rogé",0.396,314267,0.0424,0,5ru4nchmouOKZ7Xno55pzO,0.911,0,0.118,-25.059,1,Je te veux,33,1984-01-01,0.0388,102.542,0.175,1984,classical
1677,0.889,"Johann Sebastian Bach, Catherine Mackintosh/Paul Goodwin/Timothy Brown/Susan Dent/Orchestra of the Age of Enlightenment, Orchestra of the Age of Enlightenment",0.159,224333,0.0851,0,1Ynu8t0hylhDY98u5E2KFA,0.306,1,0.081,-21.457,0,Brandenburg Concerto No. 1 in F BWV1046: II. Adagio,33,1989,0.0386,133.418,0.0407,1989,classical
1678,0.958,"Johann Sebastian Bach, Catherine Mackintosh/Paul Goodwin/Timothy Brown/Susan Dent/Orchestra of the Age of Enlightenment, Orchestra of the Age of Enlightenment",0.509,253640,0.337,0,75RMtTAVUDs1EXWPGxIlCb,0.5539999999999999,4,0.431,-15.102,1,Brandenburg Concerto No. 1 in F BWV1046: III. Allegro,33,1989,0.0415,92.21,0.843,1989,classical
1679,0.93,Joe Hisaishi,0.41,125947,0.19,0,70qx6QQAIYgmgB1rYMsyyW,0.123,3,0.159,-15.229,1,To Ursula's Cabin,33,1989-08-10,0.0352,116.13,0.191,1989,"classical, country"
1680,0.963,"Johann Sebastian Bach, Monica Huggett, Orchestra of the Age of Enlightenment",0.411,443627,0.132,0,0T6j5ynARlGdwhhPnhjuH4,0.00338,6,0.292,-21.227,1,Brandenburg Concerto No. 4 in G BWV1049: I. Allegro,33,1989,0.0533,89.404,0.628,1989,classical
1681,0.98,"Gioachino Rossini, William Matteuzzi, Cecilia Bartoli, Alessandro Corbelli, Enzo Dara, Michele Pertusi, Fernanda Costa, Gloria Banditelli, Coro del Teatro Comunale di Bologna, Orchestra del Teatro Comunale di Bologna, Riccardo Chailly",0.45,189333,0.261,0,5BALnJGgdgeRY6hQPUDcyL,0.000965,4,0.0686,-16.633,1,"La Cenerentola / Act 2: ""Non più mesta""",33,1993-01-01,0.0798,136.941,0.29600000000000004,1993,"classical, hiphop"
1682,0.957,"Johann Sebastian Bach, Yo-Yo Ma",0.377,223453,0.106,0,1QSNIfsTBWNmQ2pplTD3xF,0.903,2,0.14,-28.036,1,"Cello Suite No. 6 in D Major, BWV 1012: III. Courante",33,1983,0.045,118.529,0.76,1983,"classical, hiphop, pop"
1683,0.975,"Johann Sebastian Bach, Ralph Kirshbaum",0.247,219680,0.0701,0,6bIoyULjKgikPGeqBR7vbu,0.939,2,0.212,-23.445,0,"Bach, J.S.: Cello Suite No. 2 in D Minor, BWV 1008: I. Prelude",33,1994-01-01,0.0582,126.195,0.229,1994,classical
1684,0.969,"Johann Sebastian Bach, Ralph Kirshbaum",0.203,224907,0.0925,0,6S4JmrBq5f6A88PmxOtJZf,0.938,0,0.13699999999999998,-23.446,1,"Bach, J.S.: Cello Suite No. 3 in C Major, BWV 1009: I. Prelude",33,1994-01-01,0.046,79.764,0.516,1994,classical
1685,0.136,"John Williams, London Symphony Orchestra",0.8420000000000001,169800,0.56,0,0wWZsH3b3pc62r0Z5IAMpN,0.0863,0,0.09,-14.574000000000002,1,Lapti Nek (Jabba's Palace Band),33,1983-01-01,0.0826,131.306,0.73,1983,"classical, country"
1686,0.986,"Giacomo Puccini, Maria Callas, Giuseppe Di Stefano, Orchestra Del Teatro Alla Scala, Milano, Antonino Votto, Orchestra Del Teatro Alla Scala Di Milan",0.172,301133,0.0857,0,1YT1SmwIfoIk0BYX0SMKp0,0.000278,2,0.0972,-17.69,1,Sì. mi chiamano Mimì (Mimì/Rodolfo) - 1997 Remastered Version,33,1958,0.0491,77.834,0.0496,1958,classical
1687,0.911,"Modest Mussorgsky, Leonard Bernstein, New York Philharmonic",0.316,660867,0.244,0,5rPqo5uyPn5MDoJkkiu8Nr,0.816,2,0.182,-18.218,1,Night on Bald Mountain,33,1962,0.0431,105.101,0.0642,1962,classical
1688,0.775,"Andrés Segovia, Isaac Albéniz",0.333,386573,0.252,0,4ua1Fg2a5N4N5Hj1BWR6nj,0.725,7,0.112,-21.89,1,"Suite espanola No. 1, Op. 47: No. 5. Asturias (arr. A. Segovia)",33,1954,0.047,114.505,0.344,1954,classical
1689,0.0393,X-Clan,0.8590000000000001,243773,0.785,0,6IkKUAda9Uq7827Y8TtnF9,0.00314,9,0.34,-13.038,0,Funkin' Lesson,33,1990-01-01,0.138,113.265,0.6829999999999999,1990,"classical, pop, rock"
1690,0.985,"Claude Debussy, Julian Lloyd Webber, Royal Philharmonic Orchestra, Nicholas Cleobury",0.14800000000000002,360000,0.115,0,4Ercp6nWeFD2mHHN9X1XZN,0.893,1,0.11,-23.679,1,"Suite bergamasque, L.75: Clair de lune (Arr. Palmer)",33,1986-01-01,0.0511,86.637,0.0378,1986,classical
1691,0.965,"Francisco Tárrega, Andrés Segovia",0.273,307773,0.221,0,5gcfJW6co71QHsc5kW7at0,0.915,9,0.0981,-21.215,1,Recuerdos De La Alhambra,33,1988-01-01,0.0374,79.337,0.312,1988,classical
1692,0.971,"Leopold Stokowski, Philadelphia Orchestra",0.261,156440,0.004229999999999999,0,7zLfwTYJJkgYeVDUNzWESo,0.00774,4,0.0944,-35.361,0,"The Nutcracker Suite, Op. 71A, Dance of the Sugar Plum Fairy",33,1990-01-01,0.0318,87.99799999999998,0.0818,1990,classical
1693,0.959,"Antonín Dvořák, Jacqueline du Pré, Daniel Barenboim, Chicago Symphony Orchestra",0.123,406958,0.145,0,3K0FE7QAh4R4Gi2jKWIPoP,0.8690000000000001,1,0.115,-20.277,1,"Dvorák: Silent Woods, Op. 68 No. 5, B. 182",33,1971,0.0458,95.369,0.0364,1971,classical
1694,0.926,"Luigi Boccherini, Lazar Gosman",0.498,203000,0.0789,0,5EkbgoNhM0lhIxweM8QwNq,0.514,9,0.236,-22.491,1,"String Quintet in E Major, Op. 13, No. 5: III. Minuetto",33,1972,0.0323,99.211,0.613,1972,classical
1695,0.934,"Harold Budd, Brian Eno",0.18600000000000005,252347,0.00873,0,28KcS7Otucbm1uRQs8k21t,0.84,11,0.1,-37.611,1,Still Return - 2005 Digital Remaster,33,1984,0.0419,68.31,0.0384,1984,"classical, pop, rock"
