,acousticness,artists,danceability,duration_ms,energy,explicit,id,instrumentalness,key,liveness,loudness,mode,name,popularity,release_date,speechiness,tempo,valence,year,genres
804,0.922,"Antonio Vivaldi, Nigel Kennedy, English Chamber Orchestra",0.165,140707,0.0255,0,60aQKFkmcvSQYOm9YgB3Sk,0.256,7,0.197,-28.719,0,"Vivaldi: Violin Concerto in G Minor, RV 315 ""L'estate"" (No. 2 from ""Il cimento dell'armonia e dell'inventione"", Op. 8): II. Adagio",43,1989,0.0521,92.452,0.0546,1989,"classical, pop"
805,0.254,"John Williams, London Symphony Orchestra",0.289,226360,0.282,0,5hcZYfxB15rBWrNW09gXku,0.34,0,0.108,-17.086,1,Qui-Gon's Noble End,43,1999-05-04,0.0475,135.961,0.138,1999,"classical, country"
806,0.976,"Giacomo Puccini, Renée Fleming, London Philharmonic Orchestra, Sir Charles Mackerras",0.217,172867,0.113,0,7z8kUK8x96El1IqU4WFk8Z,0.392,8,0.58,-23.596,1,"Gianni Schicchi: ""O mio babbino caro""",43,2000-01-01,0.0407,99.873,0.0912,2000,"classical, pop"
807,0.966,"Christoph Willibald Gluck, Eugene Ormandy, Philadelphia Orchestra",0.236,207107,0.0965,0,4qg7uptMkSHq8uatbgcP37,0.976,2,0.134,-25.503,0,"Orpheo ed Euridice, Wq. 30, Act II: Dance of the Blessed Spirits",43,1960,0.0524,66.73,0.0736,1960,classical
808,0.977,"Gaetano Donizetti, Luciano Pavarotti, Orchestra of the Royal Opera House, Covent Garden, Richard Bonynge",0.467,103867,0.309,0,0QExRUtwXW3SmSyOqNTc1e,0.00143,3,0.181,-14.882,1,"La fille du régiment / Act 1: Ah! mes amis, quel jour de fête!",43,1968-01-01,0.0962,81.555,0.461,1968,"classical, pop"
809,0.994,"Johann Sebastian Bach, Glenn Gould",0.315,112467,0.0814,0,61CTXQ09mPLPmzdgEdeStO,0.92,7,0.119,-25.212,1,"Goldberg Variations, BWV 988: Aria",43,1956,0.0385,104.98,0.366,1956,classical
810,0.987,"Claude Debussy, Alexis Weissenberg",0.235,306000,0.00674,0,0qCf6uHKkPpTSjvCFJt9L6,0.845,1,0.0719,-32.343,1,"Suite bergamasque, L. 75: III. Clair de lune",43,1986-01-01,0.0504,56.64,0.0393,1986,classical
811,0.828,"Johann Sebastian Bach, English Chamber Orchestra, Benjamin Britten",0.316,636427,0.243,0,7ImuASnzYk9YHn3isFjZ0j,0.0047,2,0.175,-19.476,1,"Brandenburg Concerto No.5 in D, BWV 1050: 1. Allegro",43,1995-01-01,0.0482,84.88600000000002,0.662,1995,classical
812,0.944,"Eleni Karaindrou, Kim Kashkashian, Lefteris Chalkiadakis, String Orchestra",0.0724,414360,0.00997,0,3CScbHj56svy4z8Fk6vYZ2,0.604,7,0.096,-23.385,1,Ulysses' Gaze: 9. Ulysses' Theme - Litany,43,1995-09-01,0.0476,66.095,0.046,1995,"classical, country"
813,0.911,Howard Shore,0.0671,358533,0.0777,0,4xaPCPyMiFDiw7SoksTBKo,0.852,2,0.0947,-24.175,1,"The Road Goes Ever On..., Pt. 1",43,2001,0.0424,73.277,0.0382,2001,"classical, country"
814,0.963,"Wolfgang Amadeus Mozart, Sir Neville Marriner, Academy of St. Martin in the Fields",0.245,344640,0.0473,0,3YPgZvBPN3d4yxtijMhBMN,0.0789,0,0.0798,-23.563,1,"Mozart: Serenade No. 13 in G Major, K. 525 ""Eine kleine Nachtmusik"": II. Romanze (Andante)",43,1997,0.0494,69.457,0.128,1997,classical
815,0.898,Howard Shore,0.224,159920,0.0146,0,05q7lfYerRkqqNDua3vJOL,7.77e-06,10,0.174,-31.031,1,The Passing of the Elves,43,2001,0.0342,90.886,0.0384,2001,"classical, country"
816,0.972,Howard Shore,0.091,206027,0.0619,0,3wlNmUeoHnM1jcOcXxC6qI,0.912,0,0.105,-23.247,1,Rivendell,43,2001,0.0439,86.93,0.0364,2001,"classical, country"
817,0.971,G.S. Sachdev,0.16,296307,0.00177,0,2ZJhL2pkytU1udly94xV7j,0.949,5,0.154,-36.022,1,Cosmos,43,1989-01-01,0.0516,109.634,0.403,1989,classical
818,0.986,"Alexander Borodin, Julian Lloyd Webber, Royal Philharmonic Orchestra, James Judd",0.134,245000,0.104,0,4Ihs5QBKqaVzRlfot22aKt,0.927,9,0.331,-26.546,1,Nocturne,43,1999-03-25,0.0613,81.295,0.0989,1999,classical
819,0.976,Hariprasad Chaurasia,0.486,182067,0.17,0,2NuqtLrg6LUwSWs2UVJQlx,0.368,4,0.0705,-26.929,1,Abhogi,43,1999-08-10,0.0795,95.961,0.227,1999,classical
820,0.983,Hariprasad Chaurasia,0.488,214667,0.0799,0,3hfh3VfPtFVtB9KnuNtJXo,0.177,4,0.118,-28.028,1,Bhupali,43,1999-08-10,0.0499,105.237,0.275,1999,classical
821,0.984,"Frédéric Chopin, Idil Biret",0.301,461000,0.0552,0,4FJJKMXwKerjg6YOZlSvIA,0.907,5,0.0641,-22.124,1,"Ballade No. 2 in F Major, Op. 38",43,2000-01-21,0.0464,76.012,0.04,2000,classical
822,0.988,"Frédéric Chopin, Idil Biret",0.496,149960,0.108,0,251nfOQOQYMGiAYTgDJyjp,0.836,9,0.151,-23.813,1,"Mazurkas, Op. 33: Mazurka No. 23 in D Major, Op. 33, No. 2",43,2000-01-21,0.0318,96.969,0.368,2000,classical
823,0.857,"John Williams, London Symphony Orchestra",0.12,168053,0.133,0,00sPWXrRQtyGn9BqoPbMCd,0.867,4,0.106,-18.955,0,Grievous Speaks to Lord Sidious,43,2005-05-03,0.0393,73.94,0.0616,2005,"classical, country"
824,0.969,Ryuichi Sakamoto,0.727,264267,0.14800000000000002,0,59podJoqMuHvCkw5pTNVjp,0.893,5,0.107,-14.265999999999998,1,M.A.Y. in The Backyard,43,1996,0.049,104.003,0.619,1996,"classical, country"
825,5.67e-05,DragonForce,0.14,587133,0.954,0,3B7syUJXZMAtxjil6fqqDY,0.00181,11,0.0729,-6.323,0,Soldiers Of The Wastelands,43,2004,0.129,199.947,0.142,2004,"classical, metal"
826,0.955,"Johann Baptist Vanhal, Toronto Chamber Orchestra, Kevin Mallon",0.317,304813,0.0123,0,3DruXfuowq2uyM9FkTt6A4,0.404,2,0.172,-30.127,1,"Symphony in G Major, Bryan G6: II. Andante molto grazioso",43,2005-03-01,0.0463,73.514,0.153,2005,classical
827,0.41,"John Williams, London Symphony Orchestra",0.31,245840,0.45,0,2WLufDgJx6QhqPiLWyOsHJ,0.748,5,0.0959,-14.438,0,General Grievous,43,2005-05-03,0.0479,156.83700000000005,0.18,2005,"classical, country"
828,0.968,"Franz Schubert, Andrea Bocelli, Academy Of Choir Art Of Russia, Moscow Radio Symphony Orchestra, Vladimir Fedoseyev",0.17600000000000002,266160,0.275,0,03sUk4wYNWGMMBw2wDV3Uv,0.000177,10,0.106,-14.729,1,Ave Maria,43,1995-01-01,0.0371,103.964,0.087,1995,"classical, pop"
829,3.89e-05,Helloween,0.36,315453,0.965,0,0lLhB70QIpXV2s9OT7GauB,3.66e-06,11,0.322,-6.973,0,March of Time,43,1988,0.119,147.898,0.118,1988,"classical, metal, rock"
830,0.984,"Antonio Vivaldi, Christopher Hooker, Joanna Graham, City of London Sinfonia, Nicholas Kraemer",0.481,202960,0.115,0,0COiTzBMUkI3PhgcbEFgli,0.314,2,0.157,-21.831,1,"Concerto for Oboe and Bassoon in G Major, RV 545: I. Andante molto",43,1995-12-31,0.0485,93.691,0.58,1995,classical
831,0.984,"Alexander Borodin, George Szell, Cleveland Orchestra",0.157,136960,0.0553,0,1KeJxSvW6pLU1ieRfQOMca,0.8,9,0.107,-23.391,1,Polovetsian Dances from Prince Igor: Introduzione,43,1958,0.0381,83.29899999999998,0.0421,1958,classical
832,0.87,"Johann Sebastian Bach, William McVicker",0.156,567467,0.0493,0,5cYyCE4b3T5TdQ3sGg8CYc,0.289,2,0.0873,-25.341,0,Toccata and Fugue in D minor,43,1997-11-14,0.0358,77.175,0.0673,1997,classical
833,0.955,"John Williams, Itzhak Perlman, Boston Symphony Orchestra",0.141,179000,0.0116,0,2Xa0M5kcQHdZHde9ktiXg2,0.928,7,0.0893,-33.197,0,Theme From Schindler's List (Reprise),43,1993-01-01,0.0384,72.017,0.0881,1993,"classical, country"
834,0.919,"Josef Mysliveček, London Mozart Players, Matthias Bamert",0.322,175680,0.0144,0,5FqoXdw329bYeULmYqnBls,0.727,7,0.0828,-30.108,1,"Symphony No. 4 in D Major, EvaM 10:D14: II. Andante grazioso",43,2004-05-01,0.046,81.26899999999998,0.172,2004,classical
835,0.986,Ludovico Einaudi,0.385,233467,0.0944,0,1NNrdT3dU1hHmyVSLdV7JO,0.8690000000000001,8,0.0994,-28.817,1,Dietro casa,43,2004,0.0581,103.808,0.0289,2004,"classical, pop"
836,0.976,"Joe Hisaishi, Orchestra Città di Ferrara",0.263,213960,0.17800000000000002,0,6thjKtlVjr9KgBXkjm3EGe,0.698,1,0.123,-16.430999999999994,1,Nostalgia,43,1998-10-14,0.0286,87.889,0.0579,1998,"classical, country"
837,0.986,"Gioachino Rossini, Simon Keenlyside, Ulf Schirmer",0.379,295973,0.251,0,5W7IiH2jDV6q6EQwBkq8ld,0.0122,0,0.094,-15.488,1,Largo al factotum,43,2006-09-01,0.0991,73.316,0.335,2006,classical
838,0.984,Michael Nyman,0.422,172667,0.11,0,5zNFFrj2TvLyfbAUBLvEgj,0.8440000000000001,2,0.0722,-23.377,1,Big My Secret,43,1993-01-01,0.0392,77.475,0.21,1993,"classical, country, pop"
839,0.918,"Dmitri Shostakovich, Yuri Torchinsky, Peter Dixon, BBC Philharmonic, Vassily Sinaisky",0.0636,393840,0.0344,0,2fMn5KBVhGlBQZTGrSBeZ7,0.484,1,0.0941,-29.329,1,"The Gadfly Suite, Op. 97a: VIII. Romance: Allegro moderato - Andante con moto",43,2004-03-01,0.0503,65.937,0.0353,2004,"classical, country"
840,0.677,"Karl Jenkins, Adiemus, Miriam Stockley, Jody K. Jenkins, London Philharmonic Orchestra, Mary Carewe, Frank Ricotti, Mike Taylor",0.335,476267,0.252,0,74UiAwqOTEtEBcSKDIayj6,0.261,9,0.161,-16.578,1,Kayama,43,1995,0.0331,145.035,0.16699999999999998,1995,"classical, pop"
841,0.7190000000000001,"John Williams, London Symphony Orchestra",0.191,785373,0.303,0,16vteDeKePbpJBUgDroiIJ,0.929,0,0.181,-14.137,1,A New Hope and End Credits,43,2005-05-03,0.0316,91.164,0.0901,2005,"classical, country"
842,0.984,Michael Nyman,0.284,170200,0.172,0,3xsZiFNAhVny4tPPR5Ujv8,0.8540000000000001,9,0.0931,-21.391,0,The Sacrifice,43,1993-01-01,0.0348,99.916,0.17600000000000002,1993,"classical, country, pop"
843,0.769,Antônio Carlos Jobim,0.463,124587,0.326,0,28PORYgAQ5vrbwtobRlCoq,0.0096,2,0.155,-13.01,0,A Felicidade,43,1965,0.0284,98.389,0.535,1965,"classical, jazz"
844,0.945,"Johann Sebastian Bach, Yo-Yo Ma",0.433,146427,0.14800000000000002,0,70rlzUf9y1skkI3agyvbjg,0.879,7,0.135,-21.72,1,"Cello Suite No. 1 in G Major, BWV 1007: III. Courante",43,1983,0.0381,91.374,0.588,1983,"classical, hiphop, pop"
845,0.995,"Johann Sebastian Bach, Marc Hantaï",0.386,302080,0.0288,0,2JZje7KjnzSUkoFNzwRHyL,0.878,2,0.197,-26.494,0,"Bach: Partita in A Minor, BWV 1013: I. Allemande",43,1999,0.054000000000000006,135.355,0.682,1999,classical
846,0.983,"Fritz Kreisler, Julia Krasko, Olga Kondratieva",0.335,235333,0.023,0,2Rr5drmuGCScBpcPrRV3GP,0.000143,9,0.0986,-26.922,1,Liebeslied,43,1999-01-01,0.0469,136.386,0.205,1999,classical
847,0.964,Joe Hisaishi,0.0834,99627,0.0946,0,6JqEDCqvAQx4F1D8TuQMw1,0.919,5,0.209,-15.682,0,The Legend of Ashitaka,43,1997-07-02,0.0398,169.982,0.0467,1997,"classical, country"
848,0.923,Howard Shore,0.297,105880,0.01,0,6qbUU40ECmhtaIpvhopr9e,0.565,5,0.219,-23.858,1,Farewell Dear Bilbo,43,2001,0.0395,87.765,0.234,2001,"classical, country"
849,0.965,"Luciano Pavarotti, Orchestra del Teatro Comunale di Bologna, Henry Mancini",0.334,273667,0.232,0,7jD6RtY1ngLWkUMU3Iwpnl,1.56e-05,2,0.305,-15.092,1,Volare,43,1997-01-01,0.0496,130.095,0.338,1997,"classical, country, pop"
850,0.807,"Antonio Vivaldi, Accademia I Filarmonici, Alberto Martini",0.511,98600,0.363,0,6tcTKTzid5MnguRqMXfmpq,0.963,9,0.136,-15.223,0,"Concerto for Strings in A Minor, RV 161: I. Allegro",43,1997-03-27,0.0339,115.397,0.674,1997,classical
851,0.0017,Berlin,0.49,251200,0.484,0,3Mp0s4jN8X7J74Qt6sgDXl,8.93e-05,7,0.0398,-18.35,1,The Metro,43,1982-01-01,0.0359,168.975,0.65,1982,classical
852,0.927,"Ennio Morricone, Itzhak Perlman, John Williams, Pittsburgh Symphony Orchestra",0.189,197307,0.16,0,7BHX4FX2hfw14gnvcQVJPO,0.421,10,0.111,-19.862,1,"Love Theme (From ""Cinema Paradiso"")",43,1966,0.0427,31.988000000000003,0.0749,1966,"classical, country"
853,0.976,"Pyotr Ilyich Tchaikovsky, Van Cliburn, Kirill Kondrashin",0.265,1240600,0.16899999999999998,0,7dMKKLuDqwGxPN29dmale9,0.871,10,0.0903,-16.814,0,"Piano Concerto No. 1 in B-Flat Minor, Op. 23: Allegro non troppo e molto maestoso",43,1987,0.036000000000000004,81.013,0.0399,1987,classical
854,0.991,"Johann Sebastian Bach, Glenn Gould",0.409,37027,0.208,0,325xUomC1NKDerrKIn0zfD,0.84,7,0.115,-22.097,1,"Goldberg Variations, BWV 988: Variation 5 a 1 ovvero 2 Clav.",43,1981,0.0364,82.027,0.8690000000000001,1981,classical
855,0.993,"Johann Sebastian Bach, Glenn Gould",0.435,76027,0.0585,0,4w3aG0qWqCQKhvsQYzX3nY,0.934,7,0.157,-25.416,1,"Goldberg Variations, BWV 988: Variation 7 a 1 ovvero 2 Clav.",43,1981,0.0384,52.059,0.635,1981,classical
856,0.951,"Johann Sebastian Bach, Glenn Gould",0.562,50480,0.461,0,14lyZKpPu1ECQpfXhgrip6,0.802,7,0.141,-14.43,1,"Goldberg Variations, BWV 988: Variation 4 a 1 Clav.",43,1981,0.0521,86.493,0.961,1981,classical
857,0.956,"Johann Sebastian Bach, Michael Chance, English Baroque Soloists, John Eliot Gardiner",0.14300000000000002,403160,0.0209,0,2H4DnggkcJLymT1aYtjkrP,0.000775,10,0.134,-30.537,0,"Matthäus-Passion, BWV 244 / Zweiter Teil: 39. ""Erbarme dich""",43,1989-01-01,0.0443,94.213,0.0381,1989,classical
858,0.974,"Franz Joseph Haydn, The Scottish Baroque Ensemble, Leonard Friedman",0.255,89400,0.0534,0,2K01jEOja47eLwJsh1j3ZK,0.319,4,0.109,-27.366,1,Haydn: Twelve Little Divertimenti: Menuet: Un poco allegretto,43,2002,0.0585,142.695,0.227,2002,classical
859,0.0319,Berlin,0.753,235000,0.454,0,2a2M4Zh4drzHJ7Yl2nxM04,3.6e-05,0,0.536,-14.129,1,No More Words,43,1984-01-01,0.0537,130.704,0.7979999999999999,1984,classical
860,0.936,"Johannes Brahms, Wiener Philharmoniker, Claudio Abbado",0.262,175267,0.244,0,5zWCfVmj9JHlVLNnBpIKt0,0.929,7,0.34700000000000003,-18.66,0,"Hungarian Dance No.1 in G Minor, WoO 1",43,1984-01-01,0.044,141.627,0.474,1984,classical
861,0.991,"Johann Sebastian Bach, Glenn Gould",0.326,49253,0.311,0,2mXVCqoNE6otHBcmRz4IHv,0.8759999999999999,7,0.118,-24.153,1,"Goldberg Variations, BWV 988: Variation 2 a 1 Clav.",43,1981,0.047,159.25799999999995,0.961,1981,classical
862,0.939,Brian Crain,0.184,194907,0.138,0,1lkZCo9VhizmyfU9ms1k5f,0.878,0,0.142,-16.141,1,Innocent Heart,43,2001-01-01,0.0368,75.294,0.152,2001,classical
863,0.988,"Harold Budd, Brian Eno",0.234,253893,0.0138,0,75Q2oWlmhsTiM9KTbjyduU,0.83,8,0.106,-30.699,0,The Plateaux Of Mirror - 2004 Digital Remaster,43,1980,0.0487,91.085,0.0344,1980,"classical, pop, rock"
864,0.979,"Maurice Ravel, Sir Simon Rattle, City Of Birmingham Symphony Orchestra",0.0905,327933,0.005229999999999999,0,4mnbrrduAIy9ZyNoi4byOU,0.879,1,0.0615,-28.178,1,"Ravel: Miroirs, M. 43: V. La vallée des cloches (Arr. Grainger, 1944)",43,1997-05-01,0.0412,71.001,0.0307,1997,classical
865,0.894,Joe Hisaishi,0.168,301507,0.324,0,3CLgIwptrXVh7oYmuexqVD,0.921,5,0.104,-10.839,0,The Legend of Ashitaka (Ending),43,1997-07-02,0.0357,142.859,0.175,1997,"classical, country"
866,0.9,"Antonio Vivaldi, Raphael Wallfisch, City of London Sinfonia, Nicholas Kraemer",0.433,197093,0.22,0,2o3QK3FLkD4CVn0xvj9Xj7,0.894,10,0.0628,-20.889,1,"Cello Concerto in B-Flat Major, RV 423: I. Allegro",43,1995-02-13,0.0402,122.375,0.6809999999999999,1995,classical
867,0.963,Ludovico Einaudi,0.231,477000,0.124,0,2aUUsj6puY14yvfbSyM6Jj,0.883,10,0.0859,-26.448,1,Ora,43,2004,0.0557,129.75799999999998,0.0514,2004,"classical, pop"
868,0.992,"Pyotr Ilyich Tchaikovsky, Yefim Bronfman",0.336,270800,0.0709,0,3CXvekTGvlUimWpLUCJsVi,0.858,7,0.0876,-25.69,0,"June. Barcarolle The Seasons, Op. 37b (1875-6)",43,1962,0.0494,85.79299999999998,0.17600000000000002,1962,classical
869,0.985,"Wolfgang Amadeus Mozart, Anna Tomowa-Sintow, Wiener Singverein, Wiener Philharmoniker, Herbert von Karajan",0.0839,324227,0.159,0,2OUf2NnZZQUhKtpvBWTqnP,0.7929999999999999,2,0.097,-20.433,0,"Requiem In D Minor, K.626: 1. Introitus: Requiem",43,1987-01-01,0.0384,75.99,0.0396,1987,classical
870,0.979,"Johann Sebastian Bach, Petri Alanko, Jukka Rautasalo, Anssi Mattila",0.248,196093,0.0142,0,6AYQsTYqfnOEeKGwxNRDoG,0.652,7,0.118,-26.17,1,"Flute Sonata in E Minor, BWV 1034: III. Andante",43,1997-03-12,0.0406,102.439,0.142,1997,classical
871,0.0546,Joe Satriani,0.35700000000000004,342733,0.447,0,4eTOyWkfoZP2vHT6jCfOcS,0.0516,4,0.103,-8.601,1,Cryin',43,1992-07-21,0.027000000000000003,150.94299999999996,0.151,1992,"classical, metal, rock"
872,0.949,"Antonio Vivaldi, Raphael Wallfisch, City of London Sinfonia, Nicholas Kraemer",0.42,202867,0.13,0,0JNDWe6fCiTL6N0CotmdCe,0.934,2,0.111,-22.782,0,"Cello Concerto in D Minor, RV 407: I. Allegro",42,1995-02-13,0.0378,115.975,0.59,1995,classical
873,0.934,"Antonio Vivaldi, Raphael Wallfisch, City of London Sinfonia, Nicholas Kraemer",0.442,188267,0.145,0,5gSZ1yErjxw3Rp0gUupU2U,0.856,7,0.314,-20.807,0,"Cello Concerto in G Minor, RV 416: III. Allegro",42,1995-02-09,0.0376,135.35399999999998,0.733,1995,classical
874,0.362,"Pietro Mascagni, National Philharmonic Orchestra, Gianandrea Gavazzeni, Giuseppe Patanè",0.095,190227,0.173,0,2ejVc73K8orfIk9W2uZKlg,0.8440000000000001,5,0.467,-19.528,1,Cavalleria rusticana: Intermezzo,42,1978-01-01,0.0394,173.47099999999998,0.0381,1978,classical
875,0.853,"Giacomo Puccini, Luciano Pavarotti, Orchestra del Teatro Arena di Verona, Armando Gatto",0.203,223520,0.439,0,0lUGrc1XZ6TJ6jWxk103zL,0.000923,2,0.894,-12.625,1,Turandot / Act 3: Nessun dorma! - Live,42,2000-01-01,0.0596,85.421,0.145,2000,"classical, pop"
876,0.955,Secret Garden,0.0902,188093,0.17,0,2XwLsd322WZ9hCTzYBLsZU,0.667,9,0.0917,-14.821,1,Sigma,42,1995-01-01,0.0362,83.87200000000001,0.0883,1995,"classical, pop"
877,0.5589999999999999,"John Williams, London Symphony Orchestra",0.22,383360,0.263,0,27xA5HEUnWPBDo0z4hcDq1,0.897,0,0.371,-14.081,1,Finale,42,1980-01-01,0.0338,105.105,0.122,1980,"classical, country"
878,0.909,"Leonard Bernstein, Jim Bryant, Marni Nixon, Johnny Green, West Side Story Orchestra",0.298,400467,0.124,0,1T5t8mYCEihHpd9JOdLrd3,8.41e-05,1,0.295,-16.843,1,West Side Story: Act I: Tonight,42,1961,0.0504,84.48299999999998,0.146,1961,classical
879,0.953,"Aaron Copland, Los Angeles Philharmonic, Zubin Mehta",0.0655,174800,0.0137,0,3g98x0UrsfWzpiRR2gmLtR,0.8240000000000001,9,0.108,-34.624,1,Appalachian Spring - 1945 Suite: 1. Very slowly,42,1996-01-01,0.0498,71.339,0.0328,1996,classical
880,0.936,"Alexander Borodin, Torgny Sporsen, Gothenburg Symphony Orchestra, Neeme Järvi, Gothenburg Symphony Chorus",0.225,690307,0.0972,0,0PlTjNRzj6MkPfaLHNeZLZ,0.618,2,0.0913,-21.852,1,"Polovtsian Dances From ""Prince Igor""",42,1990-01-01,0.0364,103.212,0.0793,1990,classical
881,0.888,"John Williams, London Symphony Orchestra",0.168,378320,0.181,0,3KVsq9veMUESIb3ln7Rowv,0.888,4,0.0798,-15.593,1,Imperial Attack,42,1977-01-01,0.0358,81.695,0.0377,1977,"classical, country"
882,0.992,"Johann Sebastian Bach, Ralph Kirshbaum",0.285,285080,0.101,0,6XhPptZYmFpaHbE2HnaYrE,0.818,2,0.108,-19.283,1,"Bach, J.S.: Cello Suite No. 6 in D Major, BWV 1012: IV. Sarabande",42,1994-01-01,0.0501,96.354,0.0761,1994,classical
883,0.423,"Johann Sebastian Bach, Ton Koopman",0.128,482067,0.157,0,61JrLdVyiMy8nPg63DlENb,0.865,2,0.374,-19.772,0,"Toccata and Fugue in D minor, BWV 565",42,1984-01-01,0.0335,96.935,0.125,1984,classical
884,0.923,"Johann Sebastian Bach, Emma Kirkby, Lisa Beznosiuk, Academy of Ancient Music, Christopher Hogwood",0.471,253080,0.0484,0,4uQVFTWTiyMjYrXJNwxQgV,1.1e-05,10,0.0965,-22.84800000000001,0,"Schweigt stille, plaudert nicht Cantata, BWV 211 ""Coffee Cantata"": 4. Arie: Ei! wie smeckt Coffee süße",42,1994-01-01,0.0491,131.192,0.407,1994,classical
885,0.994,"Domenico Scarlatti, Ivo Pogorelich",0.405,254000,0.0182,0,3N7GpFlh7BkEftNaEmJjnU,0.921,2,0.0639,-32.365,0,"Sonata in D Minor, K.9",42,1992-01-01,0.0398,94.423,0.32299999999999995,1992,classical
886,0.987,"Johann Sebastian Bach, Glenn Gould",0.365,40067,0.304,0,0L5cUf2OgB2GeVzxwGJv3q,0.919,7,0.162,-22.905,1,"Goldberg Variations, BWV 988: Variation 6 a 1 Clav. Canone alla Seconda",42,1981,0.0374,107.77,0.977,1981,classical
887,0.979,"Johann Sebastian Bach, Glenn Gould",0.42,53787,0.379,0,3HoLpLgT5M6U5TaWqFKgqi,0.924,7,0.28,-17.214000000000002,1,"Goldberg Variations, BWV 988: Variation 8 a 2 Clav.",42,1981,0.0466,110.698,0.974,1981,classical
888,0.957,"Edward Elgar, Sir John Barbirolli, London Symphony Orchestra",0.112,478067,0.134,0,5cwPIak6Pg5HRuXpA5ecuO,0.442,4,0.119,-20.226,0,"Elgar: Cello Concerto in E Minor, Op. 85: I. Adagio - Moderato",42,2004,0.0427,92.134,0.0457,2004,classical
889,0.83,Joe Hisaishi,0.39,135093,0.242,0,3Y9hKhFyg5BrSS8dMU075B,0.609,8,0.0961,-14.522,1,A Huge Tree in the Tsukamori Forest,42,1988,0.0323,83.969,0.0758,1988,"classical, country"
890,0.00135,Helloween,0.28,202907,0.996,0,1bwXCtmSuwNfca7NqcIyP1,1.07e-05,11,0.467,-5.462999999999999,0,I'm Alive,42,1987,0.135,153.892,0.037000000000000005,1987,"classical, metal, rock"
891,0.973,"Johann Sebastian Bach, Glenn Gould",0.275,64293,0.329,0,7Aw2j9reBy7YeXiqBHvjhE,0.8809999999999999,7,0.166,-15.509,1,"Goldberg Variations, BWV 988: Variation 10 a 1 Clav. Fughetta",42,1981,0.0374,186.273,0.8740000000000001,1981,classical
892,0.98,"William Boyce, Ross Pople",0.61,163373,0.0588,0,18y3vpQJhdgna3lx75lsy1,0.895,7,0.158,-24.909,0,Symphony No. 7 B flat major: Moderato,42,1996-03-01,0.0536,134.51,0.58,1996,classical
893,0.98,"Maurice Ravel, Daniel Barenboim, Chicago Symphony Orchestra",0.141,368133,0.0471,0,2uDdXmYZlF15iARKksHEew,0.965,7,0.16,-27.3,1,"Ravel: Pavane pour une infante défunte, M. 19",42,1992-01-01,0.0416,101.894,0.044,1992,classical
894,0.7979999999999999,"Keith Jarrett, Jan Garbarek, Palle Danielsson, Jon Christensen",0.518,300707,0.315,0,79QByJn6Hp4A677VMSJszm,0.327,3,0.101,-14.831,1,Country,42,1978-06-01,0.0302,143.64,0.479,1978,"classical, hiphop, jazz"
895,0.99,"Johann Sebastian Bach, Glenn Gould",0.537,59373,0.223,0,3DRZuYDArzcoTniRTkaax4,0.89,7,0.13699999999999998,-24.337,1,"Goldberg Variations, BWV 988: Variation 9 a 1 Clav. Canone alla Terza",42,1981,0.0513,97.19,0.961,1981,classical
896,0.157,Blackmore's Night,0.494,306133,0.711,0,0YZOgA5bZShrLXsRRVhbDz,0.0608,9,0.0909,-7.414,0,Shadow of the Moon,42,1997-09-08,0.0264,151.92600000000004,0.537,1997,"classical, pop"
897,0.964,"Morton Gould, London Symphony Orchestra, Walter Susskind, Walter Susskind, London Symphony Orchestra",0.14800000000000002,218115,0.0169,0,1pvdhULiFFPXxLL3bGHaq7,0.8,6,0.0702,-31.437,0,Spirituals for Orchestra: II. Sermon,42,1958-01-01,0.0427,93.1,0.0338,1958,classical
898,0.984,"Johann Sebastian Bach, Glenn Gould",0.43,97973,0.453,0,7gAYYUV8mC5Vfsp825sqiS,0.821,7,0.197,-17.023,1,"Goldberg Variations, BWV 988: Variation 12 Canone alla Quarta",42,1981,0.047,90.715,0.975,1981,classical
899,0.948,"Wolfgang Amadeus Mozart, János Fehérvári, Eder Quartet",0.161,546400,0.0569,0,1lcB4nlJMbXGRlPULJf22E,0.76,5,0.0996,-24.697,1,"String Quintet No. 3 in C Major, K. 515: II. Andante",42,1994-10-07,0.0489,80.268,0.136,1994,classical
900,0.991,"Wolfgang Amadeus Mozart, Moura Lympany",0.484,217227,0.146,0,01KmuCiXyLX4G0YxVCeHDq,0.96,9,0.0855,-19.951,1,"Mozart: Piano Sonata No. 11 in A Major, K. 331, ""Alla Turca"": III. Rondo alla turca",42,1995-10-13,0.0394,127.556,0.55,1995,classical
901,0.197,Trans-Siberian Orchestra,0.292,205333,0.5670000000000001,0,3sBnSBnzpEYKpJYGsAIbup,0.852,4,0.0947,-9.487,0,Christmas Eve / Sarajevo 12/24 - Instrumental,42,1996-10-15,0.0316,186.405,0.156,1996,"classical, metal"
902,0.986,"Frédéric Chopin, Nikolai Lugansky",0.146,153733,0.0365,0,5QS4Ww7pFtigfFqoSQJrP6,0.889,8,0.102,-27.61,1,"Chopin: 12 Etudes, Op. 25: No. 1 in A-Flat Major, ""Aeolian Harp""",42,1999-12-15,0.0429,66.065,0.0359,1999,classical
903,0.996,"Robert Schumann, Alfred Brendel",0.404,150600,0.0151,0,7rrDSYbroZhV6aKkbYxiuG,0.916,5,0.0946,-35.799,1,"Kinderszenen, Op.15: 7. Träumerei",42,1992-01-01,0.0652,134.935,0.282,1992,classical
904,0.996,"Jacques Ibert, Hae Won Chang",0.409,104827,0.0021100000000000003,0,6z5Pd7UoLA6e1AlHYeVzqA,0.941,0,0.0652,-40.486,1,Petite suite en 15 images: Berceuse aux etoiles (Lullaby under the Stars),42,2000-04-13,0.0668,72.365,0.547,2000,classical
905,0.988,Ludovico Einaudi,0.271,359213,0.0843,0,4CbwEZXVgxViCiPYPfGQIs,0.915,2,0.11,-25.501,1,I Giorni,42,2006-03-15,0.0526,136.15,0.0789,2006,"classical, pop"
906,0.995,"Sergei Rachmaninoff, Mischa Maisky, Pavel Gililov",0.159,424667,0.0896,0,092Zl8RpANG3tNaMANorGi,0.92,4,0.058,-21.128,0,"Vocalise, Op. 34, No. 14 - Version For Cello And Piano",42,1990-01-01,0.0446,88.906,0.0538,1990,classical
907,0.994,"Frédéric Chopin, Daniel Barenboim",0.249,280000,0.0268,0,4BTKLuoeQilGkBi47bt2hs,0.8420000000000001,5,0.0772,-27.722,0,"Nocturne No.15 In F Minor, Op.55 No.1",42,1982-01-01,0.05,79.83800000000002,0.125,1982,classical
908,0.156,David Lee Roth,0.504,349533,0.398,0,27xIf7tzHPQFX068pFYlAh,7.25e-05,7,0.0952,-14.296,1,Damn Good,42,1988-01-26,0.0461,176.009,0.361,1988,"classical, metal, rock"
909,0.000326,"Liquid Tension Experiment, Mike Portnoy, John Petrucci, Tony Levin, Jordan Rudess",0.295,535360,0.914,0,65IpX5n4xwWeoXQNdtXHos,0.8809999999999999,7,0.399,-3.411,1,Paradigm Shift,42,1998-03-10,0.0526,137.44,0.654,1998,"classical, jazz, metal, rock"
910,0.989,"Frédéric Chopin, Leif Ove Andsnes",0.4,289733,0.0402,0,32zeSRwL0fJ6HQrA7LxNwm,0.946,3,0.116,-24.799,1,"Chopin: Piano Sonata No. 1 in C Minor, Op. 4: II. Minuetto. Allegretto",42,1992-01-01,0.0361,148.183,0.128,1992,classical
911,0.6779999999999999,"Maurice Ravel, Orchestre Symphonique de Montréal, Charles Dutoit",0.294,903480,0.237,0,418dTwOTWCJ8M113A6O6sP,0.8109999999999999,0,0.0606,-19.088,1,"Boléro, M. 81",42,1982-01-01,0.043,134.451,0.266,1982,classical
912,0.235,Ludo,0.691,203387,0.73,0,6o5sSlAsvLcPdrK7HFxXp3,0.0,4,0.145,-7.8439999999999985,1,Anything For You,42,2010-01-01,0.0303,107.967,0.667,2010,"classical, pop"
913,0.93,Jean-Yves Thibaudet,0.539,74067,0.11,0,5mI1Sopbvu5PbSokfYzH5y,0.000309,7,0.231,-19.938,0,"Another Dance - From ""Pride & Prejudice"" Soundtrack",42,2005-01-01,0.0452,99.938,0.76,2005,"classical, country"
914,0.992,"Harold Budd, Brian Eno",0.342,232440,0.0314,0,6vo5a9n1HWYroioj7k6gZS,0.906,3,0.0767,-25.31900000000001,0,Foreshadowed - 2005 Digital Remaster,42,1984,0.0439,100.022,0.117,1984,"classical, pop, rock"
915,0.00165,Dream Theater,0.328,405493,0.815,0,3EGF6ArVdwduo0rGzoRma9,0.00187,4,0.116,-6.651,1,The Mirror,42,1994-10-03,0.0529,168.22,0.402,1994,"classical, metal, rock"
916,0.000644,Clan of Xymox,0.486,400333,0.888,0,2OG3u2CJvDjgwKgdnHy0Ix,0.349,10,0.114,-10.445,0,A Day,42,1985-07-01,0.0489,147.796,0.22,1985,"classical, pop, rock"
917,0.68,Philip Glass,0.206,209840,0.0367,0,7kz5wYuP7kULlvZ9xfsI59,0.967,10,0.112,-26.213,1,Koyaanisqatsi,42,1983-01-01,0.0413,65.308,0.0373,1983,"classical, country"
918,0.969,Academy of St. Martin in the Fields,0.113,314640,0.0159,0,5cOsmHu55zBVw70fG4O2mD,0.875,9,0.0578,-31.894,0,Peer Gynt Suite No.2 op. 55 Solveig's Song (Andante-Allegretto tranquillamente),42,1994,0.0459,93.219,0.0359,1994,classical
