,acousticness,artists,danceability,duration_ms,energy,explicit,id,instrumentalness,key,liveness,loudness,mode,name,popularity,release_date,speechiness,tempo,valence,year,genres
2235,0.966,"Georg Philipp Telemann, Isaac Stern",0.68,130200,0.146,0,7fL2Ft1GZ9iruLLrG9Wc43,0.171,7,0.196,-14.397,1,"Quartet in E Minor, TWV 43:E2: II. Allegro",25,1983,0.04,108.273,0.613,1983,classical
2236,0.938,David Lee Roth,0.493,171410,0.0599,0,5QTQBCkUV3osJPNS2XVgEX,2.55e-05,2,0.103,-24.219,1,Coconut Grove,25,1985-01-15,0.0399,103.295,0.262,1985,"classical, metal, rock"
2237,0.8270000000000001,"Modest Mussorgsky, Eugene Ormandy, Philadelphia Orchestra",0.239,700000,0.212,0,5FMmhANpoVzm6nXfnZKnXE,0.748,9,0.157,-19.998,1,Night on Bald Mountain,25,1961,0.0514,81.475,0.0435,1961,classical
2238,0.993,"Wolfgang Amadeus Mozart, András Schiff",0.408,174867,0.13699999999999998,0,24pRUHatC2NL2FVhQpzbjC,0.911,9,0.093,-23.586,0,"Piano Sonata No.8 in A minor, K.310: 3. Presto",25,1981-01-01,0.0437,101.677,0.565,1981,classical
2239,0.961,"Johann Sebastian Bach, Yo-Yo Ma, Ton Koopman, Amsterdam Baroque Orchestra",0.17600000000000002,148867,0.0157,0,3cKyzEix8abL7ruEZPptkU,0.909,4,0.12,-30.352,0,"Ich ruf' zu dir, Herr Jesu Christ, BWV 639",25,1983,0.0485,122.03,0.0697,1983,"classical, hiphop, pop"
2240,0.913,"Sergei Prokofiev, Gérard Philipe, Orchestre Symphonique De l'U.R.S.S, Guennadi Rojdestvenski",0.473,1622000,0.0492,0,0uX4Fdj4iCiGIaAMgZxyzX,0.000276,0,0.322,-21.929,1,Pierre et le Loup,25,1956,0.0725,120.51,0.122,1956,classical
2241,0.992,"Wolfgang Amadeus Mozart, András Schiff",0.412,300493,0.12,0,5Xn8q1i3NZHpM2YAm4yoLZ,0.917,2,0.2,-26.555,1,"Piano Sonata No.18 in D, K.576: 1. Allegro",25,1981-01-01,0.0381,138.355,0.477,1981,classical
2242,0.985,Philip Glass,0.29,423907,0.0584,0,45bOgQ4NwAPgdHumnhPAMh,0.935,5,0.13699999999999998,-24.283,0,Four,25,1979,0.0337,141.835,0.0365,1979,"classical, country"
2243,0.883,Mehdi Hassan,0.4270000000000001,194133,0.38,0,1xoxOHmcRZqygAmiXugPs5,0.0020800000000000003,5,0.14300000000000002,-13.424,0,Duniya Kisie Ke Pyar Mein,25,1976-01-01,0.0296,98.838,0.6459999999999999,1976,"classical, pop"
2244,0.685,"Leonard Bernstein, West Side Story Ensemble, Max Goberman, West Side Story Original Broadway Cast",0.473,272493,0.397,0,71LoilVErjHICT2y5Qxz2E,1.67e-05,0,0.527,-15.271,1,West Side Story (Original Broadway Cast): Act I: America,25,1957,0.313,162.058,0.649,1957,classical
2245,0.856,"Béla Bartók, Fritz Reiner, Chicago Symphony Orchestra",0.202,601680,0.0607,0,2HC7Zvfu1I3g5O99y4V4CE,0.887,1,0.0655,-21.128,1,"Concerto for Orchestra, Sz. 116, BB 123: I. Introduzione - Andante non troppo - Allegro vivace",25,1956,0.0396,129.81,0.0391,1956,classical
2246,0.91,"Victor Herbert, Lynn Harrell, Academy of St. Martin in the Fields, Sir Neville Marriner",0.0909,500000,0.0137,0,1ciWcPA96QZdqauZsjOc4G,0.234,11,0.13,-33.345,1,"Cello Concerto No.2 in E Minor, Op.30: 2. Lento - Andante tranquillo",25,1988-01-01,0.044,85.693,0.0392,1988,classical
2247,0.111,X-Clan,0.888,255467,0.531,0,1T8SducX6T6ddhTGnvUOzk,0.0,8,0.108,-15.032,1,In The Ways Of The Scales,25,1990-01-01,0.292,104.139,0.636,1990,"classical, pop, rock"
2248,0.925,"Pyotr Ilyich Tchaikovsky, Orchestra of the Royal Opera House, Covent Garden, Mark Ermler",0.194,479667,0.0939,0,4dt0y7lgJFlfQcSdwNLdLv,0.89,9,0.0703,-14.367,1,"Swan Lake, Op. 20: No. 2 Valse",25,1989-03-18,0.0373,95.714,0.0705,1989,classical
2249,0.935,"Antonio Vivaldi, Frans Brüggen, Orchestra Of The 18th Century",0.622,119893,0.265,0,1Ww5sDrcyYE7izMAHx9WiV,0.447,4,0.103,-18.39,1,"Concerto in F Major, No. 1, RV 98, Tempesta di mare: III. Presto",25,1979,0.0558,118.392,0.835,1979,classical
2250,0.7859999999999999,"George Frideric Handel, Raymond Leppard, English Chamber Orchestra",0.488,185000,0.261,0,0WUGk62QZGVucShpffPKYS,0.893,10,0.359,-20.154,1,"Solomon, HWV 67: Sinfonia ""Arrival of the Queen of Sheba""",25,1959,0.0448,118.704,0.722,1959,classical
2251,0.993,"Wolfgang Amadeus Mozart, András Schiff",0.433,297573,0.0294,0,6VwlTPpTLBpk4PDuPSWESi,0.934,9,0.0743,-33.064,1,"Piano Sonata No.18 in D, K.576: 2. Adagio",25,1981-01-01,0.0439,130.547,0.0987,1981,classical
2252,0.847,"Dmitri Shostakovich, Leonard Bernstein, New York Philharmonic",0.29,535267,0.294,0,4oczALo7rfDPhbIk1MK560,0.905,10,0.199,-14.603,1,"Symphony No. 5 in D Minor, Op. 47: IV. Allegro non troppo",25,1959,0.0408,107.024,0.139,1959,classical
2253,0.949,"Pyotr Ilyich Tchaikovsky, Orchestra of the Royal Opera House, Covent Garden, Mark Ermler",0.453,63867,0.173,0,4SvN6FEmgMzotmwyQ70PW4,0.648,10,0.199,-24.475,1,"The Nutcracker, Op. 71: No. 12, Divertissement: Le Thé - Chinese Dance",25,1989-03-07,0.038,127.213,0.653,1989,classical
2254,0.41,"Philip Glass, Michael Riesman",0.624,232040,0.0723,0,2WGGP8dkbHANSCTA4eDoQa,7.42e-06,7,0.238,-22.32800000000001,1,Einstein on the Beach: Knee Play 1,24,1979,0.0644,103.152,0.0717,1979,"classical, country"
2255,0.994,"Frédéric Chopin, Claudio Arrau",0.322,276867,0.0679,0,6wFKGWow2nmXDjir2Uvagd,0.913,8,0.095,-24.141,1,"Waltz No.5 in A Flat, Op.42 - ""Grande valse""",24,1980-01-01,0.036000000000000004,64.824,0.13699999999999998,1980,classical
2256,0.954,"Amilcare Ponchielli, Philadelphia Orchestra, Eugene Ormandy",0.341,620827,0.124,0,1soMXO5dHguB4ZVTVhcces,0.211,4,0.0641,-17.772000000000006,1,"Dance of the Hours from Act III of ""La Gioconda""",24,1959,0.0397,130.217,0.161,1959,classical
2257,0.913,"Pyotr Ilyich Tchaikovsky, Leonard Bernstein, New York Philharmonic",0.115,649240,0.123,0,7zuAY2PjlvZ0GU5hfAsY6T,0.6579999999999999,2,0.696,-20.353,1,"Serenade for Strings in C Major, Op. 48, TH 48: III. Elegy",24,1964,0.0439,153.688,0.0394,1964,classical
2258,0.988,"Johannes Brahms, Jessye Norman, Daniel Barenboim, Wolfram Christ",0.155,375000,0.0385,0,2k23hwn3m2fwwl1x9VTx07,0.0282,5,0.109,-25.683000000000003,1,"Geistliches Wiegenlied, Op. 91, No. 2",24,1983-01-01,0.0523,78.418,0.0969,1983,classical
2259,0.8440000000000001,"Leonard Bernstein, Carol Lawrence, Carmen Gutierrez, Marilyn Cooper, Elizabeth Taylor, West Side Story Original Broadway Cast",0.623,166000,0.245,0,4zLvXjNRP6VS6Mj6yXmfS3,0.0,7,0.74,-17.578,0,West Side Story (Original Broadway Cast): Act II: I Feel Pretty,24,1957,0.0572,110.455,0.7609999999999999,1957,classical
2260,0.614,"Leonard Bernstein, Johnny Green, West Side Story Orchestra, Suzie Kaye, Betty Wand, George Chakiris",0.499,299493,0.466,0,2F7UrTs1Djbu2pw9f2mQrx,3.05e-05,5,0.247,-12.326,1,West Side Story: Act I: America,24,1957,0.18600000000000005,79.774,0.628,1957,classical
2261,0.86,"Sergei Prokofiev, David Bowie, Eugene Ormandy",0.287,53600,0.0211,0,4NAVWBKitFUfe22Oh7pNDf,0.823,8,0.0815,-25.588,1,"Peter and the Wolf, Op. 67: The Duck is Caught",24,1988,0.0501,125.495,0.0392,1988,"classical, pop, rock"
2262,0.8859999999999999,"Sergei Prokofiev, David Bowie, Eugene Ormandy",0.35100000000000003,122000,0.202,0,1Vw6EwPFEAf1IZggbkcTrb,0.0771,2,0.239,-19.204,0,"Peter and the Wolf, Op. 67: The Wolf",24,1988,0.0789,85.443,0.197,1988,"classical, pop, rock"
2263,0.625,"Leonard Bernstein, New York Philharmonic, West Side Story Original Broadway Cast",0.34600000000000003,134893,0.795,0,7qvCcR5xVaCv3H35ehtN94,0.904,4,0.821,-11.828,0,"Symphonic Dances from ""West Side Story"" *: Symphonic Dances from West Side Story: Mambo (Meno presto)",24,1957,0.0584,136.545,0.07200000000000001,1957,classical
2264,0.986,"Camille Saint-Saëns, Philippe Entremont, Gaby Casadesus, Yo-Yo Ma",0.597,116373,0.254,0,1N0qNm4BndVOouPSrra12i,0.879,0,0.048,-16.467,1,"Carnival of the Animals, R. 125: Finale",24,1961,0.05,99.236,0.665,1961,"classical, hiphop, pop"
2265,0.974,"Ludwig van Beethoven, London Symphony Orchestra, Josef Krips",0.407,584493,0.271,0,7sPx2MEYA3ZuNtxS74SzTj,0.848,7,0.16,-20.17,1,"Symphony No. 9 in D Minor, Op. 125 ""Choral"": II. Molto vivace",24,1960-01-01,0.0575,123.573,0.317,1960,classical
2266,0.939,Harold Budd,0.221,246707,0.0417,0,2Ku4hCx56kQMEBn9ffS0Nf,0.8909999999999999,10,0.0917,-24.457,1,The Serpent (in Quicksilver),24,1981,0.0324,75.282,0.0316,1981,"classical, pop, rock"
2267,0.846,"John Williams, London Symphony Orchestra",0.113,172333,0.0491,0,1Sh0VuE4TAr0R7cV3fyLk8,0.638,7,0.109,-20.226,1,The Medallion,24,1981-01-01,0.0362,161.373,0.0379,1981,"classical, country"
2268,0.916,"Modest Mussorgsky, Eugene Ormandy, Philadelphia Orchestra",0.334,700027,0.265,0,28oj3TEiYAopCeZowwNju1,0.8370000000000001,2,0.168,-17.219,1,Night on Bald Mountain,24,1961,0.0477,113.12,0.0528,1961,classical
2269,0.951,"Antonín Dvořák, Emerson String Quartet",0.338,314000,0.0931,0,09Wls5EQ1M4Oa8KhQ2i3ba,0.833,5,0.1,-21.08,1,"String Quartet No.12 In F Major, Op.96, B.179 - ""American"": 4. Finale (Vivace ma non troppo)",24,1986-01-01,0.0398,83.37700000000002,0.311,1986,classical
2270,0.826,"Igor Stravinsky, Columbia Symphony Orchestra",0.11,276787,0.0873,0,5jla2Mh9KXcQC6TreFIr7R,0.8909999999999999,0,0.115,-23.287,0,"Apollon musagète - Ballet en deux tableux: Pas d'action. Apollon et les trois Muses: Calliope, Polymnie et Terpsichore. Moderato",24,1959,0.0382,87.631,0.124,1959,classical
2271,0.901,"Carl Orff, Orchester der Deutschen Oper Berlin, Eugen Jochum, Chor der Deutschen Oper Berlin",0.454,156800,0.16899999999999998,0,094EUOD4WAR49pKjn1TUOG,0.565,10,0.17800000000000002,-16.144000000000002,1,Carmina Burana / Fortuna Imperatrix Mundi: 1. O Fortuna,24,1988-01-01,0.0339,69.538,0.271,1988,classical
2272,0.992,"Frédéric Chopin, Arthur Rubinstein",0.307,373000,0.02,0,2MMm5gCJ7z9HgYGcDcuwdb,0.935,1,0.108,-25.747,1,"Nocturnes, Op. 27: No. 2 in D-Flat Major",24,1965,0.0397,79.57,0.0579,1965,classical
2273,0.992,"Johann Sebastian Bach, Glenn Gould",0.3720000000000001,125013,0.25,0,5qZd36ADDgunix3T3Gyuil,0.903,9,0.0871,-24.037,0,"Partita No. 3 in A Minor, BWV 827: III. Corrente",24,1957,0.0546,116.161,0.914,1957,classical
2274,0.992,"Johann Sebastian Bach, Glenn Gould",0.35200000000000004,125267,0.173,0,44EqPPoWZDJqDChMC3YeCI,0.947,9,0.114,-23.269,0,"Partita No. 3 in A Minor, BWV 827: II. Allemande",24,1957,0.0438,97.101,0.8320000000000001,1957,classical
2275,0.991,"Johann Sebastian Bach, Glenn Gould",0.342,336400,0.207,0,6A7j7f7bK5ASLuqO5RmV67,0.885,2,0.13699999999999998,-22.161,1,"Partita No. 4 in D Major, BWV 828: I. Overture",24,1957,0.0469,112.45,0.623,1957,classical
2276,0.993,"Johann Sebastian Bach, Glenn Gould",0.388,109373,0.31,0,2W9fhWg5ctWLusLFPtiiCx,0.916,9,0.135,-22.989,0,"Partita No. 3 in A Minor, BWV 827: I. Fantasia",24,1957,0.0555,107.869,0.938,1957,classical
2277,0.995,"Johann Sebastian Bach, Glenn Gould",0.467,106267,0.28300000000000003,0,04BhDbtyGLiA6fnQBssAXX,0.805,9,0.123,-19.765,0,"Partita No. 3 in A Minor, BWV 827: V. Burlesca",24,1957,0.0483,98.87,0.943,1957,classical
2278,0.995,"Alexander Muir, Mormon Tabernacle Choir, Eugene Ormandy",0.42,196000,0.0984,0,4GiWHIlb119Hkvt3WxqhQi,0.117,10,0.138,-19.956,1,The Maple Leaf Forever[Canada],24,1963,0.0292,95.997,0.545,1963,classical
2279,0.986,"Giacomo Puccini, Kiri Te Kanawa, Sir John Pritchard",0.28,152173,0.113,0,2FR6XOnFXf5MQLqO1VoKAe,0.00617,9,0.508,-19.782,1,Quando m'en vo from La bohème,24,1948,0.0446,105.746,0.0606,1948,"classical, pop"
2280,0.715,"Max Bruch, Jascha Heifetz, Sir Malcolm Sargent, The New Symphony Orchestra Of London",0.243,459693,0.208,0,12QMwRmDn34eWJRw7c2yJR,0.768,0,0.149,-17.188,0,"Violin Concerto No. 1 in G Minor, Op. 26: I. Vorspiel - Allegro moderato - Redbook Stereo",24,1962,0.0377,98.755,0.0758,1962,classical
2281,0.893,"Camille Saint-Saëns, Arthur Fiedler, Leo Litwin, Samuel Lipman, Martin Hoherman, Boston Pops Orchestra",0.16699999999999998,144733,0.0258,0,1yY74vgKHTA61UjIAkdGHD,0.00732,9,0.308,-36.62,0,"Carnival of the Animals, R. 125: Aquarium",24,1961,0.0401,136.028,0.131,1961,classical
2282,0.887,"Johann Pachelbel, English Chamber Orchestra, Raymond Leppard",0.188,385827,0.14400000000000002,0,6Czjr7w4SVRR9EMxB6Eeo7,0.631,2,0.224,-18.808,1,"Canon and Gigue in D Major, P. 37: Canon",24,1960,0.0365,88.445,0.185,1960,classical
2283,0.888,"Ludwig van Beethoven, Berliner Philharmoniker, Herbert von Karajan",0.177,926493,0.233,0,6CHxtUsbnSeMOW0z58bZIc,0.883,10,0.0682,-15.481,1,"Symphony No. 9 in D Minor, Op. 125 - ""Choral"": 1. Allegro ma non troppo, un poco maestoso",24,1963-01-01,0.0396,74.565,0.0937,1963,classical
2284,0.919,"Leonard Bernstein, Carol Lawrence, Larry Kert, West Side Story Original Broadway Cast",0.252,232933,0.12,0,0XLOP4XdEgKpvjEZfOW833,2.4e-06,0,0.21600000000000005,-19.058,0,West Side Story (Original Broadway Cast): Act I: Tonight,24,1957,0.038,137.429,0.147,1957,classical
2285,0.983,"Johann Sebastian Bach, Eugene Ormandy, Philadelphia Orchestra",0.196,214173,0.0553,0,1Ml8jNJRcx3OnkQR9DtYzf,0.938,4,0.0823,-22.581,0,"Come, Sweet Death",24,1957,0.0368,86.89299999999999,0.037000000000000005,1957,classical
2286,0.908,"Leonard Bernstein, Larry Kert, West Side Story Original Broadway Cast",0.365,156627,0.158,0,5RkndtuTLkiegVdx7vTNrk,0.0,7,0.117,-19.268,1,West Side Story (Original Broadway Cast): Act I: Something's Coming,24,1957,0.0426,92.707,0.412,1957,classical
2287,0.962,"Nikolai Rimsky-Korsakov, Gerhart Wiesenhütter, Gewandhausorchester Leipzig",0.336,195600,0.213,0,3qQwAkUclxuTUvMOQK0Yj9,0.954,7,0.237,-18.07,0,The Flight of the Bumble-Bee,24,1966,0.0557,83.949,0.184,1966,classical
2288,0.981,"George Frideric Handel, Mormon Tabernacle Choir, Eugene Ormandy, Philadelphia Orchestra",0.513,139027,0.299,0,7jY5Ro66Njgge6tSFN74MB,0.00444,2,0.29100000000000004,-18.663,1,"Hallelujah, Amen from Judas Maccabaeus",24,1959,0.0341,115.225,0.848,1959,classical
2289,0.953,"Benjamin Britten, Choir Of Downside School, Purley, Wandsworth School Boys Choir, London Symphony Orchestra",0.0779,184693,0.0283,0,0JnKEzgWbfvXCC9mn9xtqk,0.835,5,0.11,-29.467,0,"A Midsummer Night's Dream / Act 2: A Midsummer Night's Dream, Act 2: ""On The Ground, Sleep Sound""",24,1967-01-01,0.0415,175.97,0.0288,1967,classical
2290,0.987,"Fritz Kreisler, Yo-Yo Ma",0.219,215667,0.0316,0,40nuHwNSnJNFrEE8PuXDSw,0.887,9,0.109,-26.027,1,3 Old Viennese Dances: II. Liebesleid,24,1978,0.0438,85.337,0.0606,1978,"classical, hiphop, pop"
2291,0.97,"Johann Sebastian Bach, Mormon Tabernacle Choir, Eugene Ormandy, Philadelphia Orchestra",0.0,100200,0.0431,0,75FtHkkBTIOIYVEBwn3H7e,0.00232,2,0.213,-20.982,1,"A Mighty Fortress is Our God from Cantata No. 80, BWV 80 - Voice",24,1959,0.0,0.0,0.0,1959,classical
2292,0.94,"Maurice Ravel, Itzhak Perlman, André Previn, London Symphony Orchestra",0.3720000000000001,588387,0.112,0,1OacCHsUQIAuUtlqv4I0c2,0.532,7,0.0437,-19.78,1,"Tzigane, M. 76 (Version for Violin & Orchestra)",24,1966,0.06,89.81200000000004,0.117,1966,classical
2293,0.977,"Giacomo Puccini, Manuel Spatafora, Nicola Zaccaria, Maria Callas, Giuseppe Di Stefano, Rolando Panerai, Coro Del Teatro Alla Scala Di Milano, Antonino Votto, Orchestra Del Teatro Alla Scala, Milano, Orchestra Del Teatro Alla Scala Di Milan",0.475,170093,0.37,0,4Iw0RAwHOjy23J3Py1XFTu,0.0884,5,0.545,-15.228,0,"Aranci, datteri! (Coro/Schaunard/Colline/Rodolfo/Mimì/Marcello/Ragazzi) - 1997 Remastered Version",24,1958,0.127,105.047,0.542,1958,"classical, hiphop"
2294,0.894,"John Williams, London Symphony Orchestra",0.152,239800,0.0418,0,2zKc20TcZgSGZcqPV03zZY,0.841,9,0.108,-25.075,0,Reunion in the Tent / Searching for the Well,24,1981-01-01,0.0384,94.773,0.0346,1981,"classical, country"
2295,0.98,"Luigi Boccherini, Yo-Yo Ma, Ton Koopman, Amsterdam Baroque Orchestra",0.146,291840,0.0183,0,1q8o7sby44QbiDKABTtrwM,0.851,6,0.111,-28.939,0,"Concerto for Cello and String Orchestra in G Major, G. 480: II. Adagio",24,1983,0.0391,85.571,0.0396,1983,"classical, hiphop, pop"
2296,0.978,"Franz Liszt, Arthur Rubinstein, Alfred Wallenstein, RCA Victor Symphony Orchestra",0.328,256187,0.0667,0,4bRoHeskqCS9Q386ttf6u9,0.89,8,0.339,-24.826,0,"Piano Concerto No. 1 in E-Flat Major, S. 124: II. Quasi adagio",24,1962,0.0378,108.227,0.0683,1962,classical
2297,0.942,"Giacomo Puccini, Renata Scotto, Rolando Panerai, Coro del Teatro dell' Opera di Roma, Orchestra Del Teatro Dell'Opera Di Roma, Gianni Lazzari, Sir John Barbirolli",0.145,226333,0.187,0,2yUMwbCX1JEXC0f4HcfkW9,0.00277,6,0.0958,-17.613,1,"Madama Butterfly, Act I: Quanto cielo!....Ancora un passo or via (Coro, Butterfly, Sharpless)",24,1966,0.0404,86.726,0.039,1966,classical
2298,0.995,"Robert Schumann, Vladimir Horowitz",0.37,48107,0.058,0,5qQqJuT1RPEthmfp3amYWW,0.82,2,0.111,-28.288,1,"Kinderszenen, Op. 15: No. 5, Glückes genug",24,1962,0.054000000000000006,74.542,0.191,1962,classical
2299,0.996,"Erik Satie, William Masselos",0.4370000000000001,160640,0.00348,0,1nejJB7nBtpg9Ex7o08rWJ,0.957,9,0.0924,-38.987,0,Gymnopédies: No. 3 - Lent et grave,24,1949,0.0725,138.605,0.498,1949,classical
2300,0.941,"Christoph Willibald Gluck, Teresa Berganza, Orchestra of the Royal Opera House, Covent Garden, Sir Alexander Gibson",0.227,235093,0.122,0,1WNG5MPCHWYFOTef3zUY4v,2.05e-06,0,0.337,-17.195999999999998,1,"Orfeo ed Euridice, Wq. 30 / Act 3: ""Che farò senza Euridice?""",24,1961-01-01,0.047,77.27,0.146,1961,classical
2301,0.863,"Sergei Prokofiev, David Bowie, Eugene Ormandy",0.516,133800,0.0837,0,1u38bbPiz3aR1wWXiz5Jwy,0.00533,5,0.679,-19.688,1,"Peter and the Wolf, Op. 67: Grandfather",24,1988,0.0439,87.022,0.261,1988,"classical, pop, rock"
2302,0.964,"Georges Bizet, Nicolai Gedda, Georges Prêtre, Orchestre du Théâtre National de l'Opéra Paris, Orchestre de l'Opéra National de Paris, Paris Opera Orchestra",0.218,536040,0.129,0,08OjaQhrAR92Fq5GqAUdQ1,0.000275,0,0.207,-21.121,1,"Carmen (1997 - Remaster), Act I: Duo: Parle-moi de ma mère!",24,1964,0.0517,171.14700000000005,0.135,1964,classical
2303,0.941,"Franz Schubert, George Szell, Cleveland Orchestra",0.0844,704333,0.0451,0,6WIABwSr2Kc7GvyiPutt9F,0.618,4,0.135,-17.852,1,"Symphony No. 8 in B Minor, D. 759 ""Unfinished"": II. Andante con moto",24,1959,0.0371,83.18700000000003,0.0388,1959,classical
2304,0.867,"Antonio Vivaldi, Isaac Stern, Eugene Ormandy, Philadelphia Orchestra",0.284,171093,0.212,0,1z9HEgNDlNsdsnxZ2NKTiC,0.0559,0,0.271,-17.479,0,"Concerto for Two Violins, Strings and Continuo in C Minor, RV 509: II. Andante molto",24,1956,0.04,129.261,0.29100000000000004,1956,classical
2305,0.969,"Antonio Vivaldi, Isaac Stern, Jerusalem Music Center Chamber Orchestra",0.215,183373,0.0884,0,0IcTM1BkSeoCHckVUhuls1,0.691,7,0.415,-26.789,0,"Concerto for Violin, Strings and Continuo in G Minor, RV 315 ""L'estate"": II. Adagio",24,1956,0.0537,70.446,0.0358,1956,classical
2306,0.985,"Wolfgang Amadeus Mozart, Sir Clifford Curzon, English Chamber Orchestra, Benjamin Britten",0.155,601627,0.0348,0,22rOddQwSiY9BCR3joebsA,0.892,10,0.109,-24.939,1,"Piano Concerto No.20 in D minor, K.466: 2. Romance",24,1982-01-01,0.0364,76.467,0.0699,1982,classical
2307,0.971,"Charles Gounod, Luciano Pavarotti, Vienna Volksoper Orchestra, Leone Magiera",0.157,328627,0.208,0,4GCE6ipE5NI0DCNS8gnzT9,0.0401,8,0.298,-16.977999999999998,1,"Faust, CG 4 / Act 3: ""Quel trouble inconnu...Salut! Demeure chaste et pure""",24,1974-01-01,0.049,174.365,0.0965,1974,"classical, pop"
2308,0.993,"Erik Satie, Francis Poulenc",0.638,223453,0.0166,0,5vYOFZogXGFWVXqNKDbC1d,0.926,3,0.107,-19.477,0,Sarabande No. 2,24,1949,0.324,137.494,0.0696,1949,classical
2309,0.779,"Frank Sinatra, Antônio Carlos Jobim",0.551,669240,0.193,0,1xtDmPvNS1Mrv0ekPLFalX,0.000504,5,0.0713,-19.576,1,The Girl From Ipanema - Studio Session/'67,24,1967-03-01,0.0739,134.459,0.482,1967,"classical, jazz"
2310,0.969,Sirkazhi Govindarajan,0.28800000000000003,234133,0.534,0,78qxKTPqO7xjaeZ7SeaCJy,0.00344,8,0.14,-12.123,1,Ullathil Nalla Ullam,24,1964-01-14,0.0431,80.965,0.597,1964,classical
2311,0.965,"Ludwig van Beethoven, Berliner Philharmoniker, Herbert von Karajan",0.373,658000,0.369,0,60hAkLU6H82UK02NDKJPEZ,0.8959999999999999,7,0.214,-17.142,1,"Symphony No. 9 in D Minor, Op. 125 - ""Choral"": 2. Molto vivace",24,1963-01-01,0.08,125.342,0.322,1963,classical
2312,0.883,"Gustav Mahler, Leonard Bernstein, New York Philharmonic",0.0949,164107,0.0413,0,5nhYalsgoBo576i80YGzng,0.912,7,0.0986,-29.988000000000003,0,"Symphony No. 1 in D Major ""Titan"": IIIb. A tempo. Ziemlich langsam",24,1967,0.037000000000000005,168.672,0.16899999999999998,1967,classical
2313,0.944,"Lalo Schifrin, Bob Brookmeyer",0.589,187067,0.256,0,6FQWa9vriEXkONIOipV0Yi,0.162,10,0.199,-17.561,1,But Not For Me,24,1963-01-01,0.0583,100.819,0.899,1963,"classical, country, jazz"
2314,0.991,"Camille Saint-Saëns, Philippe Entremont, Gaby Casadesus, Yo-Yo Ma",0.498,82293,0.00733,0,0XxJCgsv3Qpd2KS7pObC6W,0.885,10,0.156,-35.44,1,"Carnival of the Animals, R. 125: The Elephant",24,1961,0.0404,120.64,0.16699999999999998,1961,"classical, hiphop, pop"
2315,0.775,London Symphony Orchestra,0.147,280427,0.155,0,4XwezUVqrPQtND9mdkG6pz,0.715,1,0.116,-18.018,1,Don't Cry for Me Argentina,24,1978-01-01,0.0348,88.14399999999998,0.0776,1978,classical
2316,0.972,"Wolfgang Amadeus Mozart, Bavarian Radio Symphony Orchestra, Bernard Haitink",0.268,450240,0.0869,0,2bAoY4xkeVpUTEMtZRXM6n,0.8959999999999999,3,0.13699999999999998,-21.092,1,"Die Zauberflöte, K. 620: Overture",24,1981,0.042,80.692,0.0804,1981,classical
2317,0.6709999999999999,"Johann Sebastian Bach, Sir Malcolm Sargent",0.166,363387,0.185,0,1OjmXxAaUYisbr6wNhyhiP,0.731,5,0.19,-21.786,1,"Concerto for 2 Violins, Strings and Continuo in D Minor BWV 1043: II. Largo, ma non tanto - Redbook Stereo",24,1961,0.0443,102.08,0.15,1961,classical
2318,0.969,"Wolfgang Amadeus Mozart, Sir Neville Marriner, Academy of St. Martin in the Fields",0.376,344533,0.0879,0,43IxylvMrbEPhOXjOVD0er,0.562,9,0.0923,-20.746,1,"Symphony No.29 In A, K. 201, 1st Movement",24,1984-01-01,0.0474,149.078,0.465,1984,classical
2319,0.915,"Georges Bizet, Nicolai Gedda, Georges Prêtre, Orchestre du Théâtre National de l'Opéra Paris, Orchestre de l'Opéra National de Paris, Paris Opera Orchestra",0.485,73773,0.145,0,2WGHZc4Clh9UkN8xiiDp7u,1.66e-06,1,0.338,-22.924,1,"Carmen (1997 - Remaster), Act I: C'est bien là, n'est-ce pas?",24,1964,0.13,97.094,0.397,1964,classical
2320,0.979,"Wolfgang Amadeus Mozart, Sir Neville Marriner, Academy of St. Martin in the Fields, Academy of St. Martin in the Fields Chorus, Laszlo Heltay, Felicity Lott",0.127,390133,0.0896,0,0iZCwQy0t6gxK2wcWzhjsa,0.0714,3,0.068,-20.807,1,"Mass In C Minor, K. 427, Kyrie",24,1984-01-01,0.0496,173.032,0.0397,1984,classical
2321,0.987,"Wolfgang Amadeus Mozart, Simon Preston, The Choir Of Westminster Abbey",0.215,257493,0.0329,0,2UHutW6Gts4qEaCwPLBSsg,0.952,5,0.132,-27.218000000000004,0,Giovanni Battista Pergolesi: Stabat Mater: Quando Corpus Morietur And Amen,24,1984-01-01,0.052000000000000005,129.74,0.0348,1984,classical
2322,0.982,"Giacomo Puccini, Renata Tebaldi, Orchestra del Maggio Musicale Fiorentino, Lamberto Gardelli",0.147,127227,0.158,0,0Q9d7cnGapigzHE20nfPkp,0.000759,8,0.335,-19.365,1,"Gianni Schicchi: ""Oh! mio babbino caro""",24,1962-01-01,0.0433,178.158,0.0374,1962,classical
2323,0.961,"Giacomo Puccini, Anna Di Stasio, Carlo Bergonzi, Rolando Panerai, Piero de Palma, Orchestra Del Teatro Dell'Opera Di Roma, Sir John Barbirolli",0.387,276227,0.172,0,6QNd9NTHNfak3je9yrTyf1,3.2299999999999986e-05,0,0.292,-18.885,1,"Madama Butterfly, Act I: Questa è la cameriera (Goro, Pinkerton, Suzuki, Sharpless)",24,1966,0.0562,97.807,0.34600000000000003,1966,classical
2324,0.991,"Frédéric Chopin, Arthur Rubinstein",0.277,341040,0.0314,0,2ZSga0mI1m1wNpxj5ZXVs6,0.942,5,0.0859,-25.936,0,"Nocturnes, Op. 55: No. 1 in F Minor",24,1965,0.0522,80.153,0.161,1965,classical
2325,0.968,"Johann Sebastian Bach, Maurice Gendron",0.199,146000,0.177,0,23v6vYuY6oS1I1ilef4xe6,0.8190000000000001,7,0.19,-20.531,1,"Suite for Solo Cello No. 1 in G Major, BWV 1007: 1. Prélude",24,1964-01-01,0.0566,82.65700000000002,0.345,1964,classical
2326,0.981,"Wolfgang Amadeus Mozart, Sir Neville Marriner, Academy of St. Martin in the Fields, Louisa Kennedy",0.402,175800,0.157,0,1aD429sLYbZQcA7qzaiaM9,0.376,5,0.159,-18.188,1,"Die Zauberflöte (The Magic Flute, K. 620); Aria (No. 14), ""Queen of the Night"" (Der Hölle Rache Kocht)",24,1984-01-01,0.0431,145.135,0.183,1984,classical
2327,0.96,"Wolfgang Amadeus Mozart, Walter Berry, Otto Klemperer, Philharmonia Orchestra",0.381,259040,0.0861,0,3grOdOohqOMv0LLO6jJiae,8.159999999999999e-05,5,0.0403,-18.525,1,"Mozart: Die Zauberflöte, K. 620, Act 2 Scene 23: No. 20, Arie, ""Ein Mädchen oder Weibchen"" (Papageno)",24,1964,0.0386,75.419,0.202,1964,"classical, hiphop"
2328,0.995,"Felix Mendelssohn, Daniel Barenboim",0.338,112000,0.0214,0,7uszjHFvYNxWfpuT4PiiJ5,0.919,7,0.0816,-34.425,0,"Lieder ohne Worte, Op.19: No. 6 In G Minor (Andante sostenuto), MWV U 78 - ""Venetian Gondola Song""",24,1974-01-01,0.0444,81.682,0.263,1974,classical
2329,0.961,"Johann Strauss II, Wiener Philharmoniker, Willi Boskovsky",0.324,501560,0.0763,0,0NcksCDqTHRxHniaMgtkAR,0.631,0,0.0464,-20.884,1,"Tausendundeine Nacht, Op. 346",24,1966-01-01,0.0392,114.802,0.14300000000000002,1966,classical
2330,0.993,"Robert Schumann, Arthur Rubinstein",0.394,208440,0.0221,0,6DWYiTubKw2kr3grLxAG58,0.9,7,0.189,-28.439,0,No. 7,24,1953,0.0535,74.435,0.183,1953,classical
2331,0.996,"Anton Rubinstein, Philippe Entremont",0.355,272147,0.0401,0,4ekbSAxl9Q71flMdFIwc8A,0.893,5,0.0794,-29.164,1,"Melody in F Major, Op. 3, No. 1",24,1953,0.0585,133.346,0.0671,1953,classical
2332,0.993,"Robert Schumann, Alicia de Larrocha",0.395,218573,0.00444,0,3tujkrqUOVDQXjNQmyFZJt,0.933,10,0.106,-30.752,1,"Kreisleriana, Op. 16: 4. Sehr langsam",24,1972-05-25,0.0475,68.947,0.0398,1972,classical
2333,0.994,"Ludwig van Beethoven, Arthur Rubinstein",0.217,372933,0.0137,0,7hqkJPyWLpu9CGNDJcRhCw,0.901,1,0.135,-39.497,0,I. Adagio sostenuto - Redbook Stereo,24,1953,0.0402,139.191,0.277,1953,classical
2334,0.86,"Dmitri Shostakovich, Leonard Bernstein, New York Philharmonic",0.138,973093,0.111,0,1J3tBkRds4SCn6KGOhd1uP,0.7809999999999999,10,0.14400000000000002,-17.866,1,"Symphony No. 5 in D Minor, Op. 47: I. Moderato",24,1959,0.0407,68.555,0.0375,1959,classical
